CASE_ENQUIRY_ID,open_dt,TARGET_DT,closed_dt,OnTime,CASE_STATUS,CLOSURE_REASON,CASE_TITLE,SUBJECT,REASON,TYPE,QUEUE,Department,SubmittedPhoto,ClosedPhoto,Location,Fire_district,pwd_district,city_council_district,police_district,neighborhood,neighborhood_services_district,ward,precinct,land_usage,LOCATION_STREET_NAME,LOCATION_ZIPCODE,propType,propid,Latitude,Longitude,Source,Geocoded_Location
1.01E+11,11/1/2018 11:30,11/1/2019 11:30, ,ONTIME,Open,,Sidewalk Repair,Public Works Department,Highway Maintenance,Sidewalk Repair,PWDx_Highway Construction,PWDx,NULL,NULL,31 Circuit St  Roxbury  MA  02119,7,10B,7,B2,Roxbury,13,Ward 12,1201,CD,31 Circuit St,2119,Address,32824,42.3237,-71.0857,Employee Generated,"(42.3237, -71.0857)"
1.01E+11,11/1/2018 10:20,11/1/2019 10:20, ,ONTIME,Open,,Sidewalk Repair,Public Works Department,Highway Maintenance,Sidewalk Repair,PWDx_Highway Construction,PWDx,NULL,NULL,INTERSECTION of Hanson St & Tremont St  Boston  MA  ,4,1C,2,D4,South End,4,3,307,,INTERSECTION Hanson St & Tremont St,,Intersection,16683,42.3594,-71.0587,Employee Generated,"(0, 0)"
1.01E+11,11/1/2018 6:43,11/1/2019 6:43, ,ONTIME,Open,,Sidewalk Repair,Public Works Department,Highway Maintenance,Sidewalk Repair,PWDx_Highway Construction,PWDx,NULL,NULL,37 Anderson St  Boston  MA  02114,3,1B,8,A1,Beacon Hill,14,Ward 5,504,A,37 Anderson St,2114,Address,178120,42.36,-71.0679,Employee Generated,"(42.36, -71.0679)"
1.01E+11,11/1/2018 6:42,11/1/2019 6:42, ,ONTIME,Open,,Sidewalk Repair,Public Works Department,Highway Maintenance,Sidewalk Repair,PWDx_Highway Construction,PWDx,NULL,NULL,INTERSECTION of Public Alley No. 303 & Pinckney St  Boston  MA  ,3,1B,7,A1,Beacon Hill,14,5,503,,INTERSECTION Public Alley No. 303 & Pinckney St,,Intersection,14171,42.3594,-71.0587,Employee Generated,"(0, 0)"
1.01E+11,11/1/2018 6:12,11/1/2019 6:12, ,ONTIME,Open,,Sidewalk Repair,Public Works Department,Highway Maintenance,Sidewalk Repair,PWDx_Highway Construction,PWDx,NULL,NULL,INTERSECTION of Cerdan Ave & Peak Hill Rd  Roslindale  MA  ,9,6,6,E5,West Roxbury,12,20,2006,,INTERSECTION Cerdan Ave & Peak Hill Rd,,Intersection,9698,42.3594,-71.0587,City Worker App,"(0, 0)"
1.01E+11,10/30/2018 6:48,10/30/2019 6:48, ,ONTIME,Open,,Sidewalk Repair,Public Works Department,Highway Maintenance,Sidewalk Repair,PWDx_Highway Construction,PWDx,NULL,NULL,INTERSECTION of New Hope Way & Worcester St  Roxbury  MA  ,4,1C,9,D4,South End,6,9,902,,INTERSECTION New Hope Way & Worcester St,,Intersection,14033,42.3594,-71.0587,Employee Generated,"(0, 0)"
1.01E+11,10/30/2018 6:46,10/30/2019 6:46, ,ONTIME,Open,,Sidewalk Repair,Public Works Department,Highway Maintenance,Sidewalk Repair,PWDx_Highway Construction,PWDx,NULL,NULL,17 Melrose St  Boston  MA  02116,4,1C,2,A1,Back Bay,6,Ward 5,501,R3,17 Melrose St,2116,Address,93942,42.3492,-71.0677,Employee Generated,"(42.3492, -71.0677)"
1.01E+11,10/29/2018 14:08,10/29/2019 14:08, ,ONTIME,Open,,Sidewalk Repair,Public Works Department,Highway Maintenance,Sidewalk Repair,PWDx_Highway Construction,PWDx,NULL,NULL,131 Pembroke St  Roxbury  MA  02118,4,1C,2,D4,South End,6,Ward 4,403,CM,131 Pembroke St,2118,Address,109050,42.3431,-71.0771,Employee Generated,"(42.3431, -71.0771)"
1.01E+11,10/29/2018 12:22,10/29/2019 12:22, ,ONTIME,Open,,Sidewalk Repair,Public Works Department,Highway Maintenance,Sidewalk Repair,PWDx_Highway Construction,PWDx,NULL,NULL,525 Massachusetts Ave  Roxbury  MA  02118,7,10B,7,D4,Roxbury,13,Ward 9,903,A,525 Massachusetts Ave,2118,Address,92307,42.3387,-71.08,Employee Generated,"(42.3387, -71.08)"
1.01E+11,11/1/2018 11:30,11/1/2019 11:30, ,ONTIME,Open,,Sidewalk Repair,Public Works Department,Highway Maintenance,Sidewalk Repair,PWDx_Highway Construction,PWDx,NULL,NULL,31 Circuit St  Roxbury  MA  02119,7,10B,7,B2,Roxbury,13,Ward 12,1201,CD,31 Circuit St,2119,Address,32824,42.3237,-71.0857,Employee Generated,"(42.3237, -71.0857)"
1.01E+11,11/1/2018 10:20,11/1/2019 10:20, ,ONTIME,Open,,Sidewalk Repair,Public Works Department,Highway Maintenance,Sidewalk Repair,PWDx_Highway Construction,PWDx,NULL,NULL,INTERSECTION of Hanson St & Tremont St  Boston  MA  ,4,1C,2,D4,South End,4,3,307,,INTERSECTION Hanson St & Tremont St,,Intersection,16683,42.3594,-71.0587,Employee Generated,"(0, 0)"
1.01E+11,11/1/2018 6:43,11/1/2019 6:43, ,ONTIME,Open,,Sidewalk Repair,Public Works Department,Highway Maintenance,Sidewalk Repair,PWDx_Highway Construction,PWDx,NULL,NULL,37 Anderson St  Boston  MA  02114,3,1B,8,A1,Beacon Hill,14,Ward 5,504,A,37 Anderson St,2114,Address,178120,42.36,-71.0679,Employee Generated,"(42.36, -71.0679)"
1.01E+11,11/1/2018 6:42,11/1/2019 6:42, ,ONTIME,Open,,Sidewalk Repair,Public Works Department,Highway Maintenance,Sidewalk Repair,PWDx_Highway Construction,PWDx,NULL,NULL,INTERSECTION of Public Alley No. 303 & Pinckney St  Boston  MA  ,3,1B,7,A1,Beacon Hill,14,5,503,,INTERSECTION Public Alley No. 303 & Pinckney St,,Intersection,14171,42.3594,-71.0587,Employee Generated,"(0, 0)"
1.01E+11,11/1/2018 6:12,11/1/2019 6:12, ,ONTIME,Open,,Sidewalk Repair,Public Works Department,Highway Maintenance,Sidewalk Repair,PWDx_Highway Construction,PWDx,NULL,NULL,INTERSECTION of Cerdan Ave & Peak Hill Rd  Roslindale  MA  ,9,6,6,E5,West Roxbury,12,20,2006,,INTERSECTION Cerdan Ave & Peak Hill Rd,,Intersection,9698,42.3594,-71.0587,City Worker App,"(0, 0)"
1.01E+11,10/30/2018 6:48,10/30/2019 6:48, ,ONTIME,Open,,Sidewalk Repair,Public Works Department,Highway Maintenance,Sidewalk Repair,PWDx_Highway Construction,PWDx,NULL,NULL,INTERSECTION of New Hope Way & Worcester St  Roxbury  MA  ,4,1C,9,D4,South End,6,9,902,,INTERSECTION New Hope Way & Worcester St,,Intersection,14033,42.3594,-71.0587,Employee Generated,"(0, 0)"
1.01E+11,10/30/2018 6:46,10/30/2019 6:46, ,ONTIME,Open,,Sidewalk Repair,Public Works Department,Highway Maintenance,Sidewalk Repair,PWDx_Highway Construction,PWDx,NULL,NULL,17 Melrose St  Boston  MA  02116,4,1C,2,A1,Back Bay,6,Ward 5,501,R3,17 Melrose St,2116,Address,93942,42.3492,-71.0677,Employee Generated,"(42.3492, -71.0677)"
1.01E+11,10/29/2018 14:08,10/29/2019 14:08, ,ONTIME,Open,,Sidewalk Repair,Public Works Department,Highway Maintenance,Sidewalk Repair,PWDx_Highway Construction,PWDx,NULL,NULL,131 Pembroke St  Roxbury  MA  02118,4,1C,2,D4,South End,6,Ward 4,403,CM,131 Pembroke St,2118,Address,109050,42.3431,-71.0771,Employee Generated,"(42.3431, -71.0771)"
1.01E+11,10/29/2018 12:22,10/29/2019 12:22, ,ONTIME,Open,,Sidewalk Repair,Public Works Department,Highway Maintenance,Sidewalk Repair,PWDx_Highway Construction,PWDx,NULL,NULL,525 Massachusetts Ave  Roxbury  MA  02118,7,10B,7,D4,Roxbury,13,Ward 9,903,A,525 Massachusetts Ave,2118,Address,92307,42.3387,-71.08,Employee Generated,"(42.3387, -71.08)"
1.01E+11,10/29/2018 12:13,10/29/2019 12:13,10/30/2018 6:48,ONTIME,Closed,Case Closed. Closed date : 2018-10-30 06:48:46.367 Case Noted Cannot locate any damage. ,Sidewalk Repair,Public Works Department,Highway Maintenance,Sidewalk Repair,PWDx_Highway Construction,PWDx,NULL,NULL,815-825 Boylston St  Boston  MA  02116,4,1C,8,D4,Back Bay,14,Ward 5,508,C,815-825 Boylston St,2116,Address,18409,42.349,-71.0824,Constituent Call,"(42.349, -71.0824)"
1.01E+11,10/29/2018 12:11,10/29/2019 12:11,10/30/2018 6:51,ONTIME,Closed,Case Closed. Closed date : 2018-10-30 06:51:22.177 Case Noted This has previously been reallocated to ISD.  This is the property owners responsibility due to the electric being run to the tree. ,Sidewalk Repair,Public Works Department,Highway Maintenance,Sidewalk Repair,PWDx_Highway Construction,PWDx,NULL,NULL,89-95 South St  Boston  MA  02111,4,1C,2,A1,Downtown / Financial District,4,3,308, ,89-95 South St,2111,Address,347782,42.3518,-71.0575,Employee Generated,"(42.3518, -71.0575)"
1.01E+11,10/29/2018 6:50,10/29/2019 6:50,10/29/2018 8:10,ONTIME,Closed,Case Closed. Closed date : 2018-10-29 08:10:59.827 Duplicate of Existing Case Duplicate of existing case    We have sent an engineer to evaluate and will take care of any immediate public safety hazards. Permanent restoration will be included in a future program when we address upgrades to the area sidewalks.    Michael Somers  Senior Civil Engineer  Construction Management Division  Boston Public Works  617-635-3831   Michael.Somers@Boston.gov   ,Sidewalk Repair,Public Works Department,Highway Maintenance,Sidewalk Repair,PWDx_Highway Construction,PWDx,NULL,NULL,INTERSECTION of Austin St & New Rutherford Ave  Charlestown  MA  ,3,1A,1,A15,Charlestown,2,2,201,,INTERSECTION Austin St & New Rutherford Ave,,Intersection,17135,42.3594,-71.0587,Employee Generated,"(0, 0)"
1.01E+11,10/29/2018 6:48,10/29/2019 6:48,10/29/2018 8:11,ONTIME,Closed,Case Closed. Closed date : 2018-10-29 08:11:23.31 Duplicate of Existing Case Duplicate of existing case    We have sent an engineer to evaluate and will take care of any immediate public safety hazards. Permanent restoration will be included in a future program when we address upgrades to the area sidewalks.    Michael Somers  Senior Civil Engineer  Construction Management Division  Boston Public Works  617-635-3831   Michael.Somers@Boston.gov   ,Sidewalk Repair,Public Works Department,Highway Maintenance,Sidewalk Repair,PWDx_Highway Construction,PWDx,NULL,NULL,INTERSECTION of Interstate 93 S & Interstate 93 N  Charlestown  MA  ,3,1A,1,A15,Charlestown,2,2,201,,INTERSECTION Interstate 93 S & Interstate 93 N,,Intersection,18544,42.3594,-71.0587,Employee Generated,"(0, 0)"
1.01E+11,10/29/2018 6:45,10/29/2019 6:45, ,ONTIME,Open,,Sidewalk Repair,Public Works Department,Highway Maintenance,Sidewalk Repair,PWDx_Highway Construction,PWDx,NULL,NULL,145 Hanover St  Boston  MA  02108,3,1B,2,A1,Downtown / Financial District,3,Ward 3,306,C,145 Hanover St,2108,Address,356342,42.3617,-71.057,Employee Generated,"(42.3617, -71.057)"
1.01E+11,10/26/2018 12:06,10/26/2019 12:06, ,ONTIME,Open,,Sidewalk Repair,Public Works Department,Highway Maintenance,Sidewalk Repair,PWDx_Highway Construction,PWDx,NULL,NULL,63-65 Court St  Boston  MA  02203,3,1B,2,A1,Boston,3,3,306,C,63-65 Court St,2203,Address,43810,42.3594,-71.0592,Employee Generated,"(42.3594, -71.0592)"
1.01E+11,10/26/2018 10:17,10/26/2019 10:17, ,ONTIME,Open,,Sidewalk Repair,Public Works Department,Highway Maintenance,Sidewalk Repair,PWDx_Highway Construction,PWDx,NULL,NULL,INTERSECTION of Tamworth St & Lagrange St  Boston  MA  ,4,1C,2,A1,Downtown / Financial District,4,3,308,,INTERSECTION Tamworth St & Lagrange St,,Intersection,13187,42.3594,-71.0587,Constituent Call,"(0, 0)"
1.01E+11,10/26/2018 9:17,10/26/2019 9:17, ,ONTIME,Open,,Sidewalk Repair,Public Works Department,Highway Maintenance,Sidewalk Repair,PWDx_Highway Construction,PWDx,NULL,NULL,INTERSECTION of Tamworth St & Lagrange St  Boston  MA  ,4,1C,2,A1,Downtown / Financial District,4,3,308,,INTERSECTION Tamworth St & Lagrange St,,Intersection,13187,42.3594,-71.0587,Constituent Call,"(0, 0)"
1.01E+11,10/26/2018 8:28,10/26/2019 8:28, ,ONTIME,Open,,Sidewalk Repair,Public Works Department,Highway Maintenance,Sidewalk Repair,PWDx_Highway Construction,PWDx,NULL,NULL,22 Bodwell St  Dorchester  MA  02125,7,3,3,B2,Dorchester,8,Ward 15,1501,R3,22 Bodwell St,2125,Address,16715,42.3129,-71.0704,Constituent Call,"(42.3129, -71.0704)"
1.01E+11,10/25/2018 15:16,10/25/2019 15:16, ,ONTIME,Open,,Sidewalk Repair,Public Works Department,Highway Maintenance,Sidewalk Repair,PWDx_Highway Construction,PWDx,NULL,NULL,238 Wachusett St  Jamaica Plain  MA  02130,12,2,6,E13,Jamaica Plain,10,Ward 19,1912,R1,238 Wachusett St,2130,Address,141187,42.2914,-71.1168,Employee Generated,"(42.2914, -71.1168)"
1.01E+11,10/25/2018 11:57,10/25/2019 11:57, ,ONTIME,Open,,Sidewalk Repair,Public Works Department,Highway Maintenance,Sidewalk Repair,PWDx_Highway Construction,PWDx,NULL,NULL,95 Worcester St  Roxbury  MA  02118,4,1C,7,D4,South End,6,9,902, ,95 Worcester St,2118,Address,350938,42.3401,-71.0782,Employee Generated,"(42.3401, -71.0782)"
1.01E+11,10/25/2018 11:55,10/25/2019 11:55, ,ONTIME,Open,,Sidewalk Repair,Public Works Department,Highway Maintenance,Sidewalk Repair,PWDx_Highway Construction,PWDx,NULL,NULL,66 Phillips St  Boston  MA  02114,3,1B,8,A1,Beacon Hill,14,Ward 5,504,R3,66 Phillips St,2114,Address,110075,42.3602,-71.069,Constituent Call,"(42.3602, -71.069)"
1.01E+11,10/25/2018 11:53,10/25/2019 11:53, ,ONTIME,Open,,Sidewalk Repair,Public Works Department,Highway Maintenance,Sidewalk Repair,PWDx_Highway Construction,PWDx,NULL,NULL,86 Chandler St  Boston  MA  02116,4,1C,2,D4,South End,6,Ward 5,501,CM,86 Chandler St,2116,Address,28824,42.3464,-71.0725,Employee Generated,"(42.3464, -71.0725)"
1.01E+11,10/24/2018 10:29,10/24/2019 10:29, ,ONTIME,Open,,Sidewalk Repair,Public Works Department,Highway Maintenance,Sidewalk Repair,PWDx_Highway Construction,PWDx,NULL,NULL,1 Bowdoin Sq  Boston  MA  02114,3,1B,1,A1,Downtown / Financial District,3,Ward 3,306,C,1 Bowdoin Sq,2114,Address,191679,42.3618,-71.0623,Employee Generated,"(42.3618, -71.0623)"
1.01E+11,10/24/2018 8:56,10/24/2019 8:56, ,ONTIME,Open,,Sidewalk Repair,Public Works Department,Highway Maintenance,Sidewalk Repair,PWDx_Highway Construction,PWDx,NULL,NULL,INTERSECTION of Washington St & Rockland St  West Roxbury  MA  ,12,6,6,E5,West Roxbury,12,20,2015,,INTERSECTION Washington St & Rockland St,,Intersection,17014,42.3594,-71.0587,Employee Generated,"(0, 0)"
1.01E+11,10/24/2018 8:26,10/24/2019 8:26, ,ONTIME,Open,,Sidewalk Repair,Public Works Department,Highway Maintenance,Sidewalk Repair,PWDx_Highway Construction,PWDx,NULL,NULL,130 Auckland St  Dorchester  MA  02125,7,3,3,C11,Dorchester,8,Ward 15,1506,EA,130 Auckland St,2125,Address,6506,42.3101,-71.0563,Constituent Call,"(42.3101, -71.0563)"
1.01E+11,10/23/2018 10:24,10/23/2019 10:24, ,ONTIME,Open,,Sidewalk Repair,Public Works Department,Highway Maintenance,Sidewalk Repair,PWDx_Highway Construction,PWDx,NULL,NULL,42 Melrose St  Boston  MA  02116,4,1C,2,A1,Back Bay,6,Ward 5,501,R2,42 Melrose St,2116,Address,93980,42.349,-71.0687,Employee Generated,"(42.349, -71.0687)"
1.01E+11,10/23/2018 10:21,10/23/2019 10:21, ,ONTIME,Open,,Sidewalk Repair,Public Works Department,Highway Maintenance,Sidewalk Repair,INFO_Mass DOT,INFO,NULL,NULL,INTERSECTION of John F. Fitzgerald Surface Rd & Hanover St  Boston  MA  ,3,1B,1,A1,Downtown / Financial District,3,3,303,,INTERSECTION John F. Fitzgerald Surface Rd & Hanover St,,Intersection,17447,42.3594,-71.0587,Employee Generated,"(0, 0)"
1.01E+11,10/23/2018 7:20,10/23/2019 7:20, ,ONTIME,Open,,Sidewalk Repair,Public Works Department,Highway Maintenance,Sidewalk Repair,PWDx_Sidewalk Repair,PWDx,NULL,NULL,INTERSECTION of Owencroft Rd & Croftland Ave  Dorchester  MA  ,8,7,4,C11,Dorchester,7,17,1704,,INTERSECTION Owencroft Rd & Croftland Ave,,Intersection,12273,42.3594,-71.0587,Employee Generated,"(0, 0)"
1.01E+11,10/22/2018 14:25,10/22/2019 14:25, ,ONTIME,Open,,Sidewalk Repair,Public Works Department,Highway Maintenance,Sidewalk Repair,PWDx_Highway Construction,PWDx,NULL,NULL,INTERSECTION of Chestnut St & W Cedar St  Boston  MA  ,3,1B,7,A1,Beacon Hill,14,5,511,,INTERSECTION Chestnut St & W Cedar St,,Intersection,16478,42.3594,-71.0587,Employee Generated,"(0, 0)"
1.01E+11,10/22/2018 14:23,10/22/2019 14:23, ,ONTIME,Open,,Sidewalk Repair,Public Works Department,Highway Maintenance,Sidewalk Repair,PWDx_Highway Construction,PWDx,NULL,NULL,INTERSECTION of Louisburg Sq & Willow St  Boston  MA  ,3,1B,7,A1,Beacon Hill,14,5,503,,INTERSECTION Louisburg Sq & Willow St,,Intersection,11684,42.3594,-71.0587,Employee Generated,"(0, 0)"
1.01E+11,10/22/2018 14:18,10/22/2019 14:18, ,ONTIME,Open,,Sidewalk Repair,Public Works Department,Highway Maintenance,Sidewalk Repair,PWDx_Highway Construction,PWDx,NULL,NULL,342-346 Commercial St  Boston  MA  02109,3,1B,1,A1,Downtown / Financial District,3,Ward 3,301,CM,342-346 Commercial St,2109,Address,36401,42.3656,-71.0514,Employee Generated,"(42.3656, -71.0514)"
1.01E+11,10/22/2018 14:13,10/22/2019 14:13, ,ONTIME,Open,,Sidewalk Repair,Public Works Department,Highway Maintenance,Sidewalk Repair,PWDx_Highway Construction,PWDx,NULL,NULL,57 Sullivan St  Charlestown  MA  02129,3,1A,1,A15,Charlestown,2,Ward 2,206,R1,57 Sullivan St,2129,Address,131836,42.3787,-71.0653,Constituent Call,"(42.3787, -71.0653)"
1.01E+11,10/22/2018 14:09,10/22/2019 14:09, ,ONTIME,Open,,Sidewalk Repair,Public Works Department,Highway Maintenance,Sidewalk Repair,PWDx_Highway Construction,PWDx,NULL,NULL,631 Washington St  Boston  MA  02116,4,1C,2,A1,Downtown / Financial District,4,Ward 3,308,,631 Washington St,2116,Address,156220,42.3526,-71.0628,Employee Generated,"(42.3526, -71.0628)"
1.01E+11,10/22/2018 13:43,10/22/2019 13:43, ,ONTIME,Open,,Sidewalk Repair,Public Works Department,Highway Maintenance,Sidewalk Repair,PWDx_Highway Construction,PWDx,NULL,NULL,80 Lambert Ave  Roxbury  MA  02119,7,10B,7,B2,Roxbury,13,Ward 9,905,R1,80 Lambert Ave,2119,Address,83637,42.3266,-71.0907,Constituent Call,"(42.3266, -71.0907)"
1.01E+11,10/22/2018 6:42,10/22/2019 6:42, ,ONTIME,Open,,Sidewalk Repair,Public Works Department,Highway Maintenance,Sidewalk Repair,PWDx_Highway Construction,PWDx,NULL,NULL,14 Wellington St  Roxbury  MA  02118,4,1C,7,D4,South End,6,Ward 4,404,CM,14 Wellington St,2118,Address,147406,42.3415,-71.082,Employee Generated,"(42.3415, -71.082)"
1.01E+11,10/22/2018 6:33,10/22/2019 6:33, ,ONTIME,Open,,Sidewalk Repair,Public Works Department,Highway Maintenance,Sidewalk Repair,PWDx_Highway Construction,PWDx,NULL,NULL,330 Dartmouth St  Boston  MA  02116,4,1C,8,D4,Back Bay,14,Ward 5,507,CM,330 Dartmouth St,2116,Address,46486,42.3533,-71.0792,Employee Generated,"(42.3533, -71.0792)"
1.01E+11,10/22/2018 6:29,10/22/2019 6:29, ,ONTIME,Open,,Sidewalk Repair,Public Works Department,Highway Maintenance,Sidewalk Repair,PWDx_Highway Construction,PWDx,NULL,NULL,657 Tremont St  Roxbury  MA  02118,4,1C,2,D4,Roxbury,6,4,403,RC,657 Tremont St,2118,Address,322053,42.3421,-71.0756,Employee Generated,"(42.3421, -71.0756)"
1.01E+11,10/22/2018 6:26,10/22/2019 6:26, ,ONTIME,Open,,Sidewalk Repair,Public Works Department,Highway Maintenance,Sidewalk Repair,PWDx_Highway Construction,PWDx,NULL,NULL,141 W Canton St  Roxbury  MA  02118,4,1C,2,D4,South End,6,Ward 4,401,R2,141 W Canton St,2118,Address,201842,42.3429,-71.0748,Employee Generated,"(42.3429, -71.0748)"
1.01E+11,10/22/2018 5:05,10/22/2019 5:05, ,ONTIME,Open,,Sidewalk Repair,Public Works Department,Highway Maintenance,Sidewalk Repair,PWDx_Highway Construction,PWDx,NULL,NULL,72 Sumner St  Dorchester  MA  02128,7,3,3,C11,Dorchester,7,13,103,EA,72 Sumner St,2128,Address,393050,42.3704,-71.0428,Employee Generated,"(42.3704, -71.0428)"
1.01E+11,10/19/2018 10:51,10/19/2019 10:51,10/22/2018 18:39,ONTIME,Closed,Case Closed. Closed date : 2018-10-22 18:39:39.553 Duplicate of Existing Case inspection requested 101002686723 ,Sidewalk Repair,Public Works Department,Highway Maintenance,Sidewalk Repair,ISD_Administrative,ISD,NULL,NULL,INTERSECTION of Essex St & Lincoln St  Boston  MA  ,4,1C,2,A1,Downtown / Financial District,4,3,308,,INTERSECTION Essex St & Lincoln St,,Intersection,15925,42.3594,-71.0587,Constituent Call,"(0, 0)"
1.01E+11,10/19/2018 10:50,10/19/2019 10:50, ,ONTIME,Open,,Sidewalk Repair,Public Works Department,Highway Maintenance,Sidewalk Repair,PWDx_Highway Construction,PWDx,NULL,NULL,150-152 Commonwealth Ave  Boston  MA  02116,4,1C,8,D4,Back Bay,14,5,507,C,150-152 Commonwealth Ave,2116,Address,156420,42.3515,-71.0778,Employee Generated,"(42.3515, -71.0778)"
1.01E+11,10/19/2018 7:45,10/19/2019 7:45, ,ONTIME,Open,,Sidewalk Repair,Public Works Department,Highway Maintenance,Sidewalk Repair,PWDx_Highway Construction,PWDx,NULL,NULL,660 Washington St  Boston  MA  02111,4,1C,2,A1,Boston,4,3,308,RC,660 Washington St,2111,Address,332048,42.3519,-71.0624,Employee Generated,"(42.3519, -71.0624)"
1.01E+11,10/19/2018 6:35,10/19/2019 6:35, ,ONTIME,Open,,Sidewalk Repair,Public Works Department,Highway Maintenance,Sidewalk Repair,PWDx_Highway Construction,PWDx,NULL,NULL,15-35 Huntington Ave  Boston  MA  02116,4,1C,2,D4,Back Bay,6,4,402,CM,15-35 Huntington Ave,2116,Address,76243,42.3488,-71.078,Employee Generated,"(42.3488, -71.078)"
1.01E+11,10/19/2018 6:11,10/19/2019 6:11,10/19/2018 7:55,ONTIME,Closed,Case Closed. Closed date : 2018-10-19 07:55:08.68 Duplicate of Existing Case We have sent an engineer to evaluate and will take care of any immediate public safety hazards. Permanent restoration will be included in a future program when we address upgrades to the area sidewalks.    Michael Somers  Senior Civil Engineer  Construction Management Division  Boston Public Works  617-635-3831   Michael.Somers@Boston.gov   ,Sidewalk Repair,Public Works Department,Highway Maintenance,Sidewalk Repair,PWDx_Highway Construction,PWDx,NULL,NULL,33 Bradston St  Roxbury  MA  02118,6,1C,2,C6,South Boston / South Boston Waterfront,6,Ward 8,802,C,33 Bradston St,2118,Address,19122,42.3333,-71.0703,Employee Generated,"(42.3333, -71.0703)"
1.01E+11,10/18/2018 10:27,10/18/2019 10:27, ,ONTIME,Open,,Sidewalk Repair,Public Works Department,Highway Maintenance,Sidewalk Repair,PWDx_Highway Construction,PWDx,NULL,NULL,328 Dartmouth St  Boston  MA  02116,4,1C,8,D4,Back Bay,14,Ward 5,507,CM,328 Dartmouth St,2116,Address,46473,42.3531,-71.0792,Constituent Call,"(42.3531, -71.0792)"
1.01E+11,10/18/2018 10:25,10/18/2019 10:25, ,ONTIME,Open,,Sidewalk Repair,Public Works Department,Highway Maintenance,Sidewalk Repair,PWDx_Highway Construction,PWDx,NULL,NULL,80 W Concord St  Roxbury  MA  02118,4,1C,7,D4,South End,6,Ward 9,902,CM,80 W Concord St,2118,Address,41971,42.3383,-71.0757,Constituent Call,"(42.3383, -71.0757)"
1.01E+11,10/18/2018 9:50,10/18/2019 9:50, ,ONTIME,Open,,Sidewalk Repair,Public Works Department,Highway Maintenance,Sidewalk Repair,PWDx_Highway Construction,PWDx,NULL,NULL,INTERSECTION of Centre St & Starr Ln  Jamaica Plain  MA  ,9,2,6,E13,Jamaica Plain,11,19,1905,,INTERSECTION Centre St & Starr Ln,,Intersection,15117,42.3594,-71.0587,Employee Generated,"(0, 0)"
1.01E+11,10/18/2018 6:37,10/18/2019 6:37, ,ONTIME,Open,,Sidewalk Repair,Public Works Department,Highway Maintenance,Sidewalk Repair,PWDx_Highway Construction,PWDx,NULL,NULL,33 Bradston St  Roxbury  MA  02118,6,1C,2,C6,South Boston / South Boston Waterfront,6,Ward 8,802,C,33 Bradston St,2118,Address,19122,42.3333,-71.0703,Employee Generated,"(42.3333, -71.0703)"
1.01E+11,10/17/2018 13:53,10/17/2019 13:53, ,ONTIME,Open,,Sidewalk Repair,Public Works Department,Highway Maintenance,Sidewalk Repair,PWDx_Sidewalk Repair,PWDx,NULL,NULL,151 Terrace St  Mission Hill  MA  02120,9,10A,8,B2,Mission Hill,14,Ward 10,1005,R3,151 Terrace St,2120,Address,318471,42.3274,-71.0987,City Worker App,"(42.3274, -71.0987)"
1.01E+11,10/17/2018 9:51,10/17/2019 9:51, ,ONTIME,Open,,Sidewalk Repair,Public Works Department,Highway Maintenance,Sidewalk Repair,PWDx_Highway Construction,PWDx,NULL,NULL,28 Woodbourne Rd  Jamaica Plain  MA  02130,12,2,6,E13,Jamaica Plain,10,Ward 19,1907,R1,28 Woodbourne Rd,2130,Address,151430,42.2912,-71.1133,Constituent Call,"(42.2912, -71.1133)"
1.01E+11,10/16/2018 13:21,10/16/2019 13:21, ,ONTIME,Open,,Sidewalk Repair,Public Works Department,Highway Maintenance,Sidewalk Repair,PWDx_Highway Construction,PWDx,NULL,NULL,865 Massachusetts Ave  Roxbury  MA  02119,7,10B,7,C6,Roxbury,13,8,806, ,865 Massachusetts Ave,2119,Address,342943,42.332,-71.0715,Employee Generated,"(42.332, -71.0715)"
1.01E+11,10/16/2018 9:06,10/16/2019 9:06, ,ONTIME,Open,,Sidewalk Repair,Public Works Department,Highway Maintenance,Sidewalk Repair,PWDx_Highway Construction,PWDx,NULL,NULL,1 City Hall Plz  Boston  MA  02108,3,1B,1,A1,Boston,3,3,306,E,1 City Hall Plz,2108,Address,32856,42.3603,-71.0583,Employee Generated,"(42.3603, -71.0583)"
1.01E+11,10/16/2018 9:05,10/16/2019 9:05, ,ONTIME,Open,,Sidewalk Repair,Public Works Department,Highway Maintenance,Sidewalk Repair,PWDx_Highway Construction,PWDx,NULL,NULL,INTERSECTION of Berkeley St & Saint James Ave  Boston  MA  ,4,1C,2,D4,Back Bay,6,5,501,,INTERSECTION Berkeley St & Saint James Ave,,Intersection,16341,42.3594,-71.0587,Constituent Call,"(0, 0)"
1.01E+11,10/16/2018 9:03,10/16/2019 9:03, ,ONTIME,Open,,Sidewalk Repair,Public Works Department,Highway Maintenance,Sidewalk Repair,PWDx_Highway Construction,PWDx,NULL,NULL,143 Richmond St  Boston  MA  02113,3,1B,1,A1,Downtown / Financial District,3,Ward 3,303,RC,143 Richmond St,2113,Address,156019,42.3634,-71.0543,Constituent Call,"(42.3634, -71.0543)"
1.01E+11,10/16/2018 5:29,10/16/2019 5:29,10/16/2018 12:06,ONTIME,Closed,Case Closed. Closed date : 2018-10-16 12:06:18.763 Case Noted No violation found at this time.  ,Sidewalk Repair,Public Works Department,Highway Maintenance,Sidewalk Repair,PWDx_Code Enforcement,PWDx,NULL,https://cityworker.cityofboston.gov:8443/attachments/report/5bc5afcbd052b22194b35a5a/closed_photo/Report.jpg,545 Medford St  Charlestown  MA  02129,3,1A,1,A15,Charlestown,2,Ward 2,207,I,545 Medford St,2129,Address,93789,42.3839,-71.0706,Employee Generated,"(42.3839, -71.0706)"
1.01E+11,10/15/2018 14:11,10/15/2019 14:11,10/16/2018 9:11,ONTIME,Closed,Case Closed. Closed date : 2018-10-16 09:11:26.447 Case Resolved Dear Constituent      The Boston Public Works Construction Inspection Unit (CIU) Inspector has identified that vault on the sidewalk needing attention as the responsibility of Ever source Electric.      Replacing or repairing vaults is not an easy repair.       Ever source has to have the vaults custom made for each separate location.       This takes time.  In addition the construction itself is technical and involved  as well as expensive.      We have informed Ever source Electric that they have to set aside resources to repair vaults around the City.     The estimated time for replacement is 6-9 months.       However  we will require Ever source to make a temporary repair such as the use of asphalt  especially if it is a major tripping hazard.      The temporary repair should be done within 3 business days.      For any questions or concern  please contact the number listed below     Sincerely      Mark Cardarelli  Supervisor of Utility Coordination and Compliance  Boston Public Works Department  617-635-4951 Office   ,Sidewalk Repair,Public Works Department,Highway Maintenance,Sidewalk Repair,PWDx_Contractor Complaints,PWDx,NULL,NULL,INTERSECTION of Fairfield St & Commonwealth Ave  Boston  MA  ,4,1C,7,D4,Back Bay,14,5,508,,INTERSECTION Fairfield St & Commonwealth Ave,,Intersection,15346,42.3594,-71.0587,Constituent Call,"(0, 0)"
1.01E+11,10/15/2018 14:08,10/15/2019 14:08, ,ONTIME,Open,,Sidewalk Repair,Public Works Department,Highway Maintenance,Sidewalk Repair,PWDx_Highway Construction,PWDx,NULL,NULL,50 Melrose St  Boston  MA  02116,4,1C,2,A1,Back Bay,6,Ward 5,501,CM,50 Melrose St,2116,Address,368063,42.3489,-71.0689,Constituent Call,"(42.3489, -71.0689)"
1.01E+11,10/15/2018 6:42,10/15/2019 6:42, ,ONTIME,Open,,Sidewalk Repair,Public Works Department,Highway Maintenance,Sidewalk Repair,PWDx_Highway Construction,PWDx,NULL,NULL,INTERSECTION of City Sq & Park St  Charlestown  MA  ,3,1A,1,A15,Charlestown,2,2,201,,INTERSECTION City Sq & Park St,,Intersection,15304,42.3594,-71.0587,Employee Generated,"(0, 0)"
1.01E+11,10/15/2018 6:37,10/15/2019 6:37, ,ONTIME,Open,,Sidewalk Repair,Public Works Department,Highway Maintenance,Sidewalk Repair,PWDx_Highway Construction,PWDx,NULL,NULL,9 Appleton St  Boston  MA  02116,4,1C,2,D4,South End,6,Ward 5,501,CM,9 Appleton St,2116,Address,4154,42.3465,-71.0703,Constituent Call,"(42.3465, -71.0703)"
1.01E+11,10/15/2018 6:34,10/15/2019 6:34, ,ONTIME,Open,,Sidewalk Repair,Public Works Department,Highway Maintenance,Sidewalk Repair,PWDx_Highway Construction,PWDx,NULL,NULL,221-223 Marlborough St  Boston  MA  02116,4,1C,8,D4,Back Bay,14,Ward 5,508,A,221-223 Marlborough St,2116,Address,167429,42.3524,-71.0812,Employee Generated,"(42.3524, -71.0812)"
1.01E+11,10/15/2018 6:27,10/15/2019 6:27, ,ONTIME,Open,,Sidewalk Repair,Public Works Department,Highway Maintenance,Sidewalk Repair,PWDx_Highway Construction,PWDx,NULL,NULL,INTERSECTION of Branch St & Charles St  Boston  MA  ,3,1B,7,A1,Beacon Hill,14,5,503,,INTERSECTION Branch St & Charles St,,Intersection,9419,42.3594,-71.0587,Employee Generated,"(0, 0)"
1.01E+11,10/15/2018 6:18,10/15/2019 6:18, ,ONTIME,Open,,Sidewalk Repair,Public Works Department,Highway Maintenance,Sidewalk Repair,PWDx_Highway Construction,PWDx,NULL,NULL,15 Charles St  Boston  MA  02114,3,1B,8,A1,Beacon Hill,14,Ward 5,503,RC,15 Charles St,2114,Address,204813,42.3566,-71.0694,Employee Generated,"(42.3566, -71.0694)"
1.01E+11,10/15/2018 6:16,10/15/2019 6:16, ,ONTIME,Open,,Sidewalk Repair,Public Works Department,Highway Maintenance,Sidewalk Repair,PWDx_Highway Construction,PWDx,NULL,NULL,INTERSECTION of Tremont Pl & Beacon St  Boston  MA  ,3,1B,2,A1,Downtown / Financial District,3,3,306,,INTERSECTION Tremont Pl & Beacon St,,Intersection,13297,42.3594,-71.0587,Employee Generated,"(0, 0)"
1.01E+11,10/12/2018 6:15,10/12/2019 6:15, ,ONTIME,Open,,Sidewalk Repair,Public Works Department,Highway Maintenance,Sidewalk Repair,INFO_Mass DOT,INFO,NULL,NULL,466-474 Atlantic Ave  Boston  MA  02110,6,1C,1,A1,Downtown / Financial District,3,Ward 3,306,C,466-474 Atlantic Ave,2110,Address,6179,42.3544,-71.0516,Employee Generated,"(42.3544, -71.0516)"
1.01E+11,10/11/2018 14:13,10/11/2019 14:13, ,ONTIME,Open,,Sidewalk Repair,Public Works Department,Highway Maintenance,Sidewalk Repair,INFO_Mass DOT,INFO,NULL,NULL,INTERSECTION of Herald St & Shawmut Ave  Boston  MA  ,4,1C,2,D4,Downtown / Financial District,4,3,308,,INTERSECTION Herald St & Shawmut Ave,,Intersection,16701,42.3594,-71.0587,Employee Generated,"(0, 0)"
1.01E+11,10/11/2018 11:38,10/11/2019 11:38, ,ONTIME,Open,,Sidewalk Repair,Public Works Department,Highway Maintenance,Sidewalk Repair,PWDx_Highway Construction,PWDx,NULL,NULL,INTERSECTION of Stillman Pl & Cross St  Boston  MA  ,3,1B,1,A1,Downtown / Financial District,3,3,304,,INTERSECTION Stillman Pl & Cross St,,Intersection,16228,42.3594,-71.0587,Constituent Call,"(0, 0)"
1.01E+11,10/11/2018 10:48,10/11/2019 10:48, ,ONTIME,Open,,Sidewalk Repair,Public Works Department,Highway Maintenance,Sidewalk Repair,PWDx_Highway Construction,PWDx,NULL,NULL,435 Weld St  West Roxbury  MA  02132,9,6,6,E5,West Roxbury,12,Ward 20,2019,R1,435 Weld St,2132,Address,147151,42.2931,-71.1499,City Worker App,"(42.2931, -71.1499)"
1.01E+11,10/11/2018 10:41,10/11/2019 10:41,10/12/2018 7:43,ONTIME,Closed,Case Closed. Closed date : 2018-10-12 07:43:28.51 Duplicate of Existing Case We have sent an engineer to evaluate and will take care of any immediate public safety hazards. Permanent restoration will be included in a future program when we address upgrades to the area sidewalks.    Michael Somers  Senior Civil Engineer  Construction Management Division  Boston Public Works  617-635-3831   Michael.Somers@Boston.gov   ,Sidewalk Repair,Public Works Department,Highway Maintenance,Sidewalk Repair,PWDx_Sidewalk Repair,PWDx,NULL,NULL,191 Webster St  East Boston  MA  02128,1,9,1,A7,East Boston,1,Ward 1,101,R4,191 Webster St,2128,Address,146814,42.3652,-71.034,Constituent Call,"(42.3652, -71.034)"
1.01E+11,10/11/2018 10:40,10/11/2019 10:40,10/12/2018 7:43,ONTIME,Closed,Case Closed. Closed date : 2018-10-12 07:43:42.07 Duplicate of Existing Case We have sent an engineer to evaluate and will take care of any immediate public safety hazards. Permanent restoration will be included in a future program when we address upgrades to the area sidewalks.    Michael Somers  Senior Civil Engineer  Construction Management Division  Boston Public Works  617-635-3831   Michael.Somers@Boston.gov   ,Sidewalk Repair,Public Works Department,Highway Maintenance,Sidewalk Repair,PWDx_Sidewalk Repair,PWDx,NULL,NULL,191 Webster St  East Boston  MA  02128,1,9,1,A7,East Boston,1,Ward 1,101,R4,191 Webster St,2128,Address,146814,42.3652,-71.034,Constituent Call,"(42.3652, -71.034)"
1.01E+11,10/11/2018 9:00,10/11/2019 9:00, ,ONTIME,Open,,Sidewalk Repair,Public Works Department,Highway Maintenance,Sidewalk Repair,PWDx_Highway Construction,PWDx,NULL,NULL,INTERSECTION of Island St & Massachusetts Ave  Roxbury  MA  ,7,1C,3,C6,South Boston / South Boston Waterfront,13,8,806,,INTERSECTION Island St & Massachusetts Ave,,Intersection,11324,42.3594,-71.0587,Employee Generated,"(0, 0)"
1.01E+11,10/11/2018 8:58,10/11/2019 8:58, ,ONTIME,Open,,Sidewalk Repair,Public Works Department,Highway Maintenance,Sidewalk Repair,PWDx_Highway Construction,PWDx,NULL,NULL,7 Warren Ave  Boston  MA  02116,4,1C,2,D4,South End,6,Ward 5,501,A,7 Warren Ave,2116,Address,369114,42.3455,-71.0706,Employee Generated,"(42.3455, -71.0706)"
1.01E+11,10/11/2018 8:54,10/11/2019 8:54, ,ONTIME,Open,,Sidewalk Repair,Public Works Department,Highway Maintenance,Sidewalk Repair,PWDx_Highway Construction,PWDx,NULL,NULL,INTERSECTION of Massachusetts Ave & Columbus Ave  Roxbury  MA  ,4,1C,9,D4,South End,6,9,902,,INTERSECTION Massachusetts Ave & Columbus Ave,,Intersection,14800,42.3594,-71.0587,Employee Generated,"(0, 0)"
1.01E+11,10/11/2018 8:52,10/11/2019 8:52, ,ONTIME,Open,,Sidewalk Repair,Public Works Department,Highway Maintenance,Sidewalk Repair,PWDx_Highway Construction,PWDx,NULL,NULL,540 Tremont St  Roxbury  MA  02118,4,1C,2,D4,South End,4,Ward 3,307,RC,540 Tremont St,2118,Address,137618,42.3441,-71.071,Constituent Call,"(42.3441, -71.071)"
1.01E+11,10/11/2018 8:51,10/11/2019 8:51, ,ONTIME,Open,,Sidewalk Repair,Public Works Department,Highway Maintenance,Sidewalk Repair,PWDx_Highway Construction,PWDx,NULL,NULL,INTERSECTION of Dartmouth St & Stuart St  Boston  MA  ,4,1C,2,D4,Back Bay,6,4,402,,INTERSECTION Dartmouth St & Stuart St,,Intersection,16556,42.3594,-71.0587,Employee Generated,"(0, 0)"
1.01E+11,10/11/2018 8:47,10/11/2019 8:47, ,ONTIME,Open,,Sidewalk Repair,Public Works Department,Highway Maintenance,Sidewalk Repair,PWDx_Highway Construction,PWDx,NULL,NULL,236 Beacon St  Boston  MA  02116,4,1C,8,D4,Back Bay,14,Ward 5,507,CM,236 Beacon St,2116,Address,10359,42.3539,-71.0793,Constituent Call,"(42.3539, -71.0793)"
1.01E+11,10/11/2018 8:46,10/11/2019 8:46, ,ONTIME,Open,,Sidewalk Repair,Public Works Department,Highway Maintenance,Sidewalk Repair,PWDx_Highway Construction,PWDx,NULL,NULL,841 Boylston St  Boston  MA  02116,4,1C,8,D4,Back Bay,14,Ward 5,508,C,841 Boylston St,2116,Address,155861,42.3489,-71.0828,Constituent Call,"(42.3489, -71.0828)"
1.01E+11,10/11/2018 7:22,10/11/2019 7:22, ,ONTIME,Open,,Sidewalk Repair,Public Works Department,Highway Maintenance,Sidewalk Repair,PWDx_Highway Construction,PWDx,NULL,NULL,INTERSECTION of Cambridge St & New Chardon St  Boston  MA  ,3,1B,2,A1,Beacon Hill,3,3,306,,INTERSECTION Cambridge St & New Chardon St,,Intersection,16436,42.3594,-71.0587,Employee Generated,"(0, 0)"
1.01E+11,10/11/2018 6:27,10/11/2019 6:27, ,ONTIME,Open,,Sidewalk Repair,Public Works Department,Highway Maintenance,Sidewalk Repair,PWDx_Highway Construction,PWDx,NULL,NULL,42 Embassy Rd  Brighton  MA  02135,11,4,9,D14,Allston / Brighton,15,Ward 22,2209,R1,42 Embassy Rd,2135,Address,53509,42.3421,-71.1565,Employee Generated,"(42.3421, -71.1565)"
1.01E+11,10/10/2018 14:02,10/10/2019 14:02, ,ONTIME,Open,,BREAKOUT,Public Works Department,Highway Maintenance,Sidewalk Repair,PWDx_Highway Construction,PWDx,NULL,NULL,530 Beacon St  Boston  MA  02215,4,10A,8,D4,Back Bay,14,Ward 5,509,A,530 Beacon St,2215,Address,11913,42.3507,-71.0911,Employee Generated,"(42.3507, -71.0911)"
1.01E+11,10/10/2018 10:33,10/10/2019 10:33, ,ONTIME,Open,,Sidewalk Repair,Public Works Department,Highway Maintenance,Sidewalk Repair,PWDx_Highway Construction,PWDx,NULL,NULL,150 Lincoln St  Boston  MA  02111,4,1C,2,A1,Downtown / Financial District,4,Ward 3,308,CC,150 Lincoln St,2111,Address,86059,42.351,-71.0583,Employee Generated,"(42.351, -71.0583)"
1.01E+11,10/10/2018 10:30,10/10/2019 10:30, ,ONTIME,Open,,Sidewalk Repair,Public Works Department,Highway Maintenance,Sidewalk Repair,PWDx_Highway Construction,PWDx,NULL,NULL,INTERSECTION of Anthony Rip Valenti Way & Friend St  Boston  MA  ,3,1B,2,A1,Downtown / Financial District,3,3,306,,INTERSECTION Anthony Rip Valenti Way & Friend St,,Intersection,8948,42.3594,-71.0587,Employee Generated,"(0, 0)"
1.01E+11,10/10/2018 10:29,10/10/2019 10:29, ,ONTIME,Open,,Sidewalk Repair,Public Works Department,Highway Maintenance,Sidewalk Repair,PWDx_Highway Construction,PWDx,NULL,NULL,59 Cooper St  Boston  MA  02113,3,1B,1,A1,Downtown / Financial District,3,Ward 3,304,RC,59 Cooper St,2113,Address,218635,42.3645,-71.0581,Employee Generated,"(42.3645, -71.0581)"
1.01E+11,10/10/2018 10:27,10/10/2019 10:27, ,ONTIME,Open,,Sidewalk Repair,Public Works Department,Highway Maintenance,Sidewalk Repair,PWDx_Highway Construction,PWDx,NULL,NULL,50 N Margin St  Boston  MA  02113,3,1B,1,A1,Downtown / Financial District,3,Ward 3,304,R4,50 N Margin St,2113,Address,89687,42.3647,-71.0568,Employee Generated,"(42.3647, -71.0568)"
1.01E+11,10/10/2018 10:26,10/10/2019 10:26,10/10/2018 10:57,ONTIME,Closed,Case Closed. Closed date : 2018-10-10 10:57:05.073 Case Noted PROPERTY OWNERS RESPONSIBILITY ,Sidewalk Repair,Public Works Department,Highway Maintenance,Sidewalk Repair,PWDx_Sidewalk Repair,PWDx,NULL,NULL,69 Bromfield St  Boston  MA  02108,3,1C,1,A1,Downtown / Financial District,3,Ward 3,306,C,69 Bromfield St,2108,Address,155955,42.3571,-71.0609,Constituent Call,"(42.3571, -71.0609)"
1.01E+11,10/10/2018 7:08,10/10/2019 7:08, ,ONTIME,Open,,Sidewalk Repair,Public Works Department,Highway Maintenance,Sidewalk Repair,PWDx_Sidewalk Repair,PWDx,NULL,NULL,INTERSECTION of Parker St & Ruggles St  Boston  MA  ,9,10A,9,D4,Fenway / Kenmore / Audubon Circle / Longwood,13,4,409,,INTERSECTION Parker St & Ruggles St,,Intersection,18389,42.3594,-71.0587,Constituent Call,"(0, 0)"
1.01E+11,10/10/2018 6:39,10/10/2019 6:39, ,ONTIME,Open,,Sidewalk Repair,Public Works Department,Highway Maintenance,Sidewalk Repair,PWDx_Highway Construction,PWDx,NULL,NULL,19 Prospect St  Charlestown  MA  02129,3,1A,1,A15,Charlestown,2,Ward 2,203,CM,19 Prospect St,2129,Address,113446,42.3753,-71.0577,Constituent Call,"(42.3753, -71.0577)"
1.01E+11,10/10/2018 6:31,10/10/2019 6:31, ,ONTIME,Open,,Sidewalk Repair,Public Works Department,Highway Maintenance,Sidewalk Repair,PWDx_Highway Construction,PWDx,NULL,NULL,42 Melrose St  Boston  MA  02116,4,1C,2,A1,Back Bay,6,Ward 5,501,R2,42 Melrose St,2116,Address,93980,42.349,-71.0687,Employee Generated,"(42.349, -71.0687)"
1.01E+11,10/10/2018 6:30,10/10/2019 6:30, ,ONTIME,Open,,Sidewalk Repair,Public Works Department,Highway Maintenance,Sidewalk Repair,PWDx_Highway Construction,PWDx,NULL,NULL,839-843 Boylston St  Boston  MA  02116,4,1C,8,D4,Back Bay,14,Ward 5,508,C,839-843 Boylston St,2116,Address,18412,42.3489,-71.0828,Employee Generated,"(42.3489, -71.0828)"
1.01E+11,10/10/2018 6:27,10/10/2019 6:27, ,ONTIME,Open,,Sidewalk Repair,Public Works Department,Highway Maintenance,Sidewalk Repair,PWDx_Highway Construction,PWDx,NULL,NULL,44 Aguadilla St  Roxbury  MA  02118,4,1C,2,D4,South End,6,Ward 9,901,EA,44 Aguadilla St,2118,Address,370272,42.3412,-71.0756,Employee Generated,"(42.3412, -71.0756)"
1.01E+11,10/10/2018 6:24,10/10/2019 6:24, ,ONTIME,Open,,Sidewalk Repair,Public Works Department,Highway Maintenance,Sidewalk Repair,PWDx_Highway Construction,PWDx,NULL,NULL,INTERSECTION of Tufts St & Lincoln St  Boston  MA  ,4,1C,2,A1,Downtown / Financial District,4,3,308,,INTERSECTION Tufts St & Lincoln St,,Intersection,13319,42.3594,-71.0587,Employee Generated,"(0, 0)"
1.01E+11,10/10/2018 6:23,10/10/2019 6:23, ,ONTIME,Open,,Sidewalk Repair,Public Works Department,Highway Maintenance,Sidewalk Repair,PWDx_Highway Construction,PWDx,NULL,NULL,121 Beach St  Boston  MA  02111,4,1C,2,A1,Downtown / Financial District,4,Ward 3,308,CM,121 Beach St,2111,Address,359237,42.3506,-71.0577,Employee Generated,"(42.3506, -71.0577)"
1.01E+11,10/10/2018 6:21,10/10/2019 6:21, ,ONTIME,Open,,Sidewalk Repair,Public Works Department,Highway Maintenance,Sidewalk Repair,PWDx_Highway Construction,PWDx,NULL,NULL,120 South St  Boston  MA  02111,4,1C,2,A1,Downtown / Financial District,4,Ward 3,308,CM,120 South St,2111,Address,359420,42.3508,-71.0572,Employee Generated,"(42.3508, -71.0572)"
1.01E+11,10/9/2018 10:13,10/9/2019 10:13, ,ONTIME,Open,,Sidewalk Repair,Public Works Department,Highway Maintenance,Sidewalk Repair,PWDx_Sidewalk Repair,PWDx,NULL,NULL,221-225 Wachusett St  Jamaica Plain  MA  02130,12,2,6,E13,Jamaica Plain,10,19,1907, ,221-225 Wachusett St,2130,Address,351505,42.2917,-71.1171,Employee Generated,"(42.2917, -71.1171)"
1.01E+11,10/9/2018 9:59,10/9/2019 9:59, ,ONTIME,Open,,BREAKOUT,Public Works Department,Highway Maintenance,Sidewalk Repair,PWDx_Highway Construction,PWDx,NULL,NULL,17 Stellman Rd  Roslindale  MA  02131,12,2,5,E5,Roslindale,10,Ward 19,1913,R3,17 Stellman Rd,2131,Address,130503,42.2892,-71.124,Employee Generated,"(42.2892, -71.124)"
1.01E+11,10/9/2018 7:40,10/9/2019 7:40,10/9/2018 8:15,ONTIME,Closed,Case Closed. Closed date : 2018-10-09 08:15:42.527 Case Noted The sidewalk did not move.  Private walkway sunk.  NOT City of Boston responsibility. ,Sidewalk Repair,Public Works Department,Highway Maintenance,Sidewalk Repair,PWDx_Sidewalk Repair,PWDx,NULL,NULL,191 Webster St  East Boston  MA  02128,1,9,1,A7,East Boston,1,Ward 1,101,R4,191 Webster St,2128,Address,146814,42.3652,-71.034,Constituent Call,"(42.3652, -71.034)"
1.01E+11,10/9/2018 7:39,10/9/2019 7:39,10/9/2018 8:16,ONTIME,Closed,Case Closed. Closed date : 2018-10-09 08:16:02.77 Duplicate of Existing Case ,Sidewalk Repair,Public Works Department,Highway Maintenance,Sidewalk Repair,PWDx_Sidewalk Repair,PWDx,NULL,NULL,191 Webster St  East Boston  MA  02128,1,9,1,A7,East Boston,1,Ward 1,101,R4,191 Webster St,2128,Address,146814,42.3652,-71.034,Constituent Call,"(42.3652, -71.034)"
1.01E+11,10/9/2018 6:39,10/9/2019 6:39, ,ONTIME,Open,,Sidewalk Repair,Public Works Department,Highway Maintenance,Sidewalk Repair,PWDx_Sidewalk Repair,PWDx,NULL,NULL,49 N Margin St  Boston  MA  02113,3,1B,1,A1,Downtown / Financial District,3,Ward 3,304,C,49 N Margin St,2113,Address,158421,42.3651,-71.0565,Employee Generated,"(42.3651, -71.0565)"
1.01E+11,10/9/2018 6:33,10/9/2019 6:33, ,ONTIME,Open,,RED BRICK,Public Works Department,Highway Maintenance,Sidewalk Repair,PWDx_Highway Construction,PWDx,NULL,NULL,INTERSECTION of W Dedham St & Monsignor Reynolds Way  Roxbury  MA  ,4,1C,2,D4,South End,6,9,901,,INTERSECTION W Dedham St & Monsignor Reynolds Way,,Intersection,15623,42.3594,-71.0587,Employee Generated,"(0, 0)"
1.01E+11,10/9/2018 6:32,10/9/2019 6:32, ,ONTIME,Open,,RED BRICK,Public Works Department,Highway Maintenance,Sidewalk Repair,PWDx_Highway Construction,PWDx,NULL,NULL,INTERSECTION of W Dedham St & Monsignor Reynolds Way  Roxbury  MA  ,4,1C,2,D4,South End,6,9,901,,INTERSECTION W Dedham St & Monsignor Reynolds Way,,Intersection,15623,42.3594,-71.0587,Employee Generated,"(0, 0)"
1.01E+11,10/9/2018 6:30,10/9/2019 6:30, ,ONTIME,Open,,Sidewalk Repair,Public Works Department,Highway Maintenance,Sidewalk Repair,PWDx_Sidewalk Repair,PWDx,NULL,NULL,618 Harrison Ave  Roxbury  MA  02118,4,1C,2,D4,Roxbury,6,8,801,RC,618 Harrison Ave,2118,Address,166044,42.34,-71.0686,Employee Generated,"(42.34, -71.0686)"
1.01E+11,10/9/2018 6:29,10/9/2019 6:29,10/10/2018 8:18,ONTIME,Closed,Case Closed. Closed date : 2018-10-10 08:18:00.72 Case Noted Duplicate of Case #101000845298.    Thank you for bringing this matter to our attention.    Staff from the Boston Public Works Department has reviewed the location and we are of the opinion that the location is a candidate for reconstruction.     Your request and location have been added to the master list of future reconstruction projects. Currently  the wait time for a reconstruction project of this nature can be up to five (5) or more years.    If you feel that there is an immediate safety concern at this location  please contact 617-635-4500 so that maintenance can be performed to make the location safer until the reconstruction can be started.    In the meantime  you may contact the Public Works Department Engineering Division at 617-635-4968 for information on your request.  Again  we appreciate and thank you for your interest in public safety and the welfare of your community.   ,Sidewalk Repair,Public Works Department,Highway Maintenance,Sidewalk Repair,PWDx_Engineering_Design,PWDx,NULL,NULL,52 Plympton St  Roxbury  MA  02118,4,1C,2,D4,South End,6,Ward 8,801,I,52 Plympton St,2118,Address,111424,42.3387,-71.0676,Employee Generated,"(42.3387, -71.0676)"
1.01E+11,10/9/2018 6:27,10/9/2019 6:27, ,ONTIME,Open,,Sidewalk Repair,Public Works Department,Highway Maintenance,Sidewalk Repair,PWDx_Sidewalk Repair,PWDx,NULL,NULL,32 Plympton St  Roxbury  MA  02118,4,1C,2,D4,South End,6,Ward 8,801,RC,32 Plympton St,2118,Address,371645,42.3392,-71.0682,Employee Generated,"(42.3392, -71.0682)"
1.01E+11,10/9/2018 6:24,10/9/2019 6:24,10/9/2018 7:15,ONTIME,Closed,Case Closed. Closed date : 2018-10-09 07:15:11.96 Case Noted This sidewalk belongs to the property owners and is their responsibility to maintain. ,Sidewalk Repair,Public Works Department,Highway Maintenance,Sidewalk Repair,PWDx_Highway Construction,PWDx,NULL,NULL,25 Lincoln St  Boston  MA  02111,3,1C,2,A1,Downtown / Financial District,4,Ward 3,308,C,25 Lincoln St,2111,Address,359493,42.3531,-71.058,Employee Generated,"(42.3531, -71.058)"
1.01E+11,10/9/2018 6:23,10/9/2019 6:23,10/9/2018 7:19,ONTIME,Closed,Case Closed. Closed date : 2018-10-09 07:19:15.033 Case Noted Location will be included in the upcoming Beach Street reconstruction    If you have any further questions  or feel that this case was closed in error  please do not hesitate to contact me.    Michael Somers  Senior Civil Engineer  Construction Management Division  Boston Public Works  617-635-3831   Michael.Somers@Boston.gov   ,Sidewalk Repair,Public Works Department,Highway Maintenance,Sidewalk Repair,PWDx_Highway Construction,PWDx,NULL,NULL,INTERSECTION of Utica St & Beach St  Boston  MA  ,4,1C,2,A1,Downtown / Financial District,4,3,308,,INTERSECTION Utica St & Beach St,,Intersection,14612,42.3594,-71.0587,Employee Generated,"(0, 0)"
1.01E+11,10/9/2018 6:21,10/9/2019 6:21, ,ONTIME,Open,,Sidewalk Repair,Public Works Department,Highway Maintenance,Sidewalk Repair,PWDx_Highway Construction,PWDx,NULL,NULL,INTERSECTION of Tufts St & Utica St  Boston  MA  ,4,1C,2,A1,Downtown / Financial District,4,3,308,,INTERSECTION Tufts St & Utica St,,Intersection,13317,42.3594,-71.0587,Employee Generated,"(0, 0)"
1.01E+11,10/9/2018 6:20,10/9/2019 6:20, ,ONTIME,Open,,Sidewalk Repair,Public Works Department,Highway Maintenance,Sidewalk Repair,PWDx_Highway Construction,PWDx,NULL,NULL,INTERSECTION of Tufts St & South St  Boston  MA  ,4,1C,2,A1,Downtown / Financial District,4,3,308,,INTERSECTION Tufts St & South St,,Intersection,13318,42.3594,-71.0587,Employee Generated,"(0, 0)"
1.01E+11,10/9/2018 6:18,10/9/2019 6:18,10/9/2018 7:16,ONTIME,Closed,Case Closed. Closed date : 2018-10-09 07:16:51.853 Duplicate of Existing Case We have sent an engineer to evaluate and will take care of any immediate public safety hazards. Permanent restoration will be included in a future program when we address upgrades to the area sidewalks.    Michael Somers  Senior Civil Engineer  Construction Management Division  Boston Public Works  617-635-3831   Michael.Somers@Boston.gov   ,Sidewalk Repair,Public Works Department,Highway Maintenance,Sidewalk Repair,PWDx_Highway Construction,PWDx,NULL,NULL,86 South St  Boston  MA  02111,4,1C,2,A1,Downtown / Financial District,4,Ward 3,308,CD,86 South St,2111,Address,128610,42.3513,-71.0571,Employee Generated,"(42.3513, -71.0571)"
1.01E+11,10/9/2018 6:17,10/9/2019 6:17,10/9/2018 7:17,ONTIME,Closed,Case Closed. Closed date : 2018-10-09 07:17:40.17 Case Noted Location will be included in an upcoming reconstruction project.    If you have any further questions  or feel that this case was closed in error  please do not hesitate to contact me.    Michael Somers  Senior Civil Engineer  Construction Management Division  Boston Public Works  617-635-3831   Michael.Somers@Boston.gov     ,Sidewalk Repair,Public Works Department,Highway Maintenance,Sidewalk Repair,PWDx_Highway Construction,PWDx,NULL,NULL,INTERSECTION of South St & Beach St  Boston  MA  ,4,1C,2,A1,Downtown / Financial District,4,3,308,,INTERSECTION South St & Beach St,,Intersection,15903,42.3594,-71.0587,Employee Generated,"(0, 0)"
1.01E+11,10/9/2018 6:08,10/9/2019 6:08, ,ONTIME,Open,,Sidewalk Repair,Public Works Department,Highway Maintenance,Sidewalk Repair,PWDx_Highway Construction,PWDx,NULL,NULL,278 Clarendon St  Boston  MA  02116,4,1C,8,D4,Back Bay,14,Ward 5,507,CM,278 Clarendon St,2116,Address,33248,42.3539,-71.077,Employee Generated,"(42.3539, -71.077)"
1.01E+11,10/9/2018 6:04,10/9/2019 6:04,10/9/2018 7:20,ONTIME,Closed,Case Closed. Closed date : 2018-10-09 07:20:07.68 Duplicate of Existing Case Duplicate of existing case 101002237192    We have sent an engineer to evaluate and will take care of any immediate public safety hazards. Permanent restoration will be included in a future program when we address upgrades to the area sidewalks.    Michael Somers  Senior Civil Engineer  Construction Management Division  Boston Public Works  617-635-3831   Michael.Somers@Boston.gov   ,Sidewalk Repair,Public Works Department,Highway Maintenance,Sidewalk Repair,PWDx_Highway Construction,PWDx,NULL,NULL,33 Adams St  Dorchester  MA  02122,7,3,3,C11,Dorchester,8,Ward 15,1503,CM,33 Adams St,2122,Address,635,42.3073,-71.0629,Employee Generated,"(42.3073, -71.0629)"
1.01E+11,10/9/2018 6:00,10/9/2019 6:00, ,ONTIME,Open,,Sidewalk Repair,Public Works Department,Highway Maintenance,Sidewalk Repair,PWDx_Highway Construction,PWDx,NULL,NULL,39 Adams St  Dorchester  MA  02122,7,3,3,C11,Dorchester,8,15,1503,R1,39 Adams St,2122,Address,704,42.3073,-71.0627,Employee Generated,"(42.3073, -71.0627)"
1.01E+11,10/6/2018 6:00,10/6/2019 6:00,10/6/2018 7:19,ONTIME,Closed,Case Closed. Closed date : 2018-10-06 07:19:13.757 Case Noted We have sent an engineer to evaluate and will take care of any immediate public safety hazards. Permanent restoration will be included in a future program when we address upgrades to the area sidewalks.    Michael Somers  Senior Civil Engineer  Construction Management Division  Boston Public Works  617-635-3831   Michael.Somers@Boston.gov   ,Sidewalk Repair,Public Works Department,Highway Maintenance,Sidewalk Repair,PWDx_Highway Construction,PWDx,NULL,NULL,INTERSECTION of Tufts St & Lincoln St  Boston  MA  ,4,1C,2,A1,Downtown / Financial District,4,3,308,,INTERSECTION Tufts St & Lincoln St,,Intersection,13319,42.3594,-71.0587,Employee Generated,"(0, 0)"
1.01E+11,10/6/2018 5:59,10/6/2019 5:59, ,ONTIME,Open,,Sidewalk Repair,Public Works Department,Highway Maintenance,Sidewalk Repair,PWDx_Highway Construction,PWDx,NULL,NULL,70 Lincoln St  Boston  MA  02111,4,1C,2,A1,Boston,4,3,308,CD,70 Lincoln St,2111,Address,86138,42.352,-71.0579,Employee Generated,"(42.352, -71.0579)"
1.01E+11,10/6/2018 5:58,10/6/2019 5:58,10/6/2018 7:18,ONTIME,Closed,Case Closed. Closed date : 2018-10-06 07:18:01.047 Case Noted Cannot determine where this is by the picture.  Please resubmit with better picture. ,Sidewalk Repair,Public Works Department,Highway Maintenance,Sidewalk Repair,PWDx_Highway Construction,PWDx,NULL,NULL,INTERSECTION of Union St & Hanover St  Boston  MA  ,3,1B,2,A1,Downtown / Financial District,3,3,306,,INTERSECTION Union St & Hanover St,,Intersection,16235,42.3594,-71.0587,Employee Generated,"(0, 0)"
1.01E+11,10/6/2018 5:57,10/6/2019 5:57, ,ONTIME,Open,,Sidewalk Repair,Public Works Department,Highway Maintenance,Sidewalk Repair,PWDx_Highway Construction,PWDx,NULL,NULL,INTERSECTION of Tufts St & Lincoln St  Boston  MA  ,4,1C,2,A1,Downtown / Financial District,4,3,308,,INTERSECTION Tufts St & Lincoln St,,Intersection,13319,42.3594,-71.0587,Employee Generated,"(0, 0)"
1.01E+11,10/5/2018 13:58,10/5/2019 13:58, ,ONTIME,Open,,Sidewalk Repair,Public Works Department,Highway Maintenance,Sidewalk Repair,PWDx_Highway Construction,PWDx,NULL,NULL,38 Worcester Sq  Roxbury  MA  02118,4,1C,2,D4,South End,6,Ward 8,802,RC,38 Worcester Sq,2118,Address,152318,42.3363,-71.0739,Constituent Call,"(42.3363, -71.0739)"
1.01E+11,10/5/2018 13:58,10/5/2019 13:58,10/5/2018 14:15,ONTIME,Closed,Case Closed. Closed date : 2018-10-05 14:15:45.537 Case Noted Sidewalk was sawcut and will have construction on if for the next week. ,Sidewalk Repair,Public Works Department,Highway Maintenance,Sidewalk Repair,PWDx_Highway Construction,PWDx,NULL,NULL,INTERSECTION of Harvard St & Tyler St  Boston  MA  ,4,1C,2,A1,Downtown / Financial District,4,3,308,,INTERSECTION Harvard St & Tyler St,,Intersection,15683,42.3594,-71.0587,Employee Generated,"(0, 0)"
1.01E+11,10/5/2018 13:57,10/5/2019 13:57, ,ONTIME,Open,,Sidewalk Repair,Public Works Department,Highway Maintenance,Sidewalk Repair,PWDx_Highway Construction,PWDx,NULL,NULL,20 Charles St  Boston  MA  02114,3,1B,8,A1,Beacon Hill,14,5,505,CM,20 Charles St,2114,Address,163154,42.3566,-71.0698,Employee Generated,"(42.3566, -71.0698)"
1.01E+11,10/5/2018 13:57,10/5/2019 13:57,10/5/2018 14:16,ONTIME,Closed,Case Closed. Closed date : 2018-10-05 14:16:31.64 Duplicate of Existing Case We have sent an engineer to evaluate and will take care of any immediate public safety hazards. Permanent restoration will be included in a future program when we address upgrades to the area sidewalks.    Michael Somers  Senior Civil Engineer  Construction Management Division  Boston Public Works  617-635-3831   Michael.Somers@Boston.gov   ,Sidewalk Repair,Public Works Department,Highway Maintenance,Sidewalk Repair,PWDx_Highway Construction,PWDx,NULL,NULL,401 Bunker Hill St  Charlestown  MA  02129,3,1A,1,A15,Charlestown,2,Ward 2,207,R1,401 Bunker Hill St,2129,Address,23648,42.3826,-71.0697,Employee Generated,"(42.3826, -71.0697)"
1.01E+11,10/4/2018 13:10,10/4/2019 13:10, ,ONTIME,Open,,Sidewalk Repair,Public Works Department,Highway Maintenance,Sidewalk Repair,PWDx_Sidewalk Repair,PWDx,NULL,NULL,1211 Bennington St  East Boston  MA  02128,1,9,1,A7,East Boston,1,Ward 1,112,R3,1211 Bennington St,2128,Address,14598,42.3892,-70.9977,Constituent Call,"(42.3892, -70.9977)"
1.01E+11,10/4/2018 13:02,10/4/2019 13:02, ,ONTIME,Open,,Sidewalk Repair,Public Works Department,Highway Maintenance,Sidewalk Repair,PWDx_Highway Construction,PWDx,NULL,NULL,68 Crawford St  Dorchester  MA  02121,9,10B,7,B2,Roxbury,13,Ward 12,1209,R2,68 Crawford St,2121,Address,44122,42.3128,-71.0886,Constituent Call,"(42.3128, -71.0886)"
1.01E+11,10/4/2018 12:58,10/4/2019 12:58,10/5/2018 7:47,ONTIME,Closed,Case Closed. Closed date : 2018-10-05 07:47:07.233 Duplicate of Existing Case We have sent an engineer to evaluate and will take care of any immediate public safety hazards. Permanent restoration will be included in a future program when we address upgrades to the area sidewalks.    Michael Somers  Senior Civil Engineer  Construction Management Division  Boston Public Works  617-635-3831   Michael.Somers@Boston.gov   ,Sidewalk Repair,Public Works Department,Highway Maintenance,Sidewalk Repair,PWDx_Highway Construction,PWDx,NULL,NULL,179 Hillside St  Mission Hill  MA  02120,9,10A,8,B2,Mission Hill,14,Ward 10,1004,R2,179 Hillside St,2120,Address,376391,42.3319,-71.1078,Employee Generated,"(42.3319, -71.1078)"
1.01E+11,10/4/2018 12:47,10/4/2019 12:47,10/5/2018 7:38,ONTIME,Closed,Case Closed. Closed date : 2018-10-05 07:38:40.687 Case Noted We have sent an engineer to evaluate and will take care of any immediate public safety hazards. Permanent restoration will be included in a future program when we address upgrades to the area sidewalks.    Michael Somers  Senior Civil Engineer  Construction Management Division  Boston Public Works  617-635-3831   Michael.Somers@Boston.gov   ,Sidewalk Repair,Public Works Department,Highway Maintenance,Sidewalk Repair,PWDx_Sidewalk Repair,PWDx,NULL,NULL,16 Keswick St  Boston  MA  02215,4,10A,8,D4,Fenway / Kenmore / Audubon Circle / Longwood,14,Ward 21,2101,R1,16 Keswick St,2215,Address,81488,42.3456,-71.1055,Employee Generated,"(42.3456, -71.1055)"
1.01E+11,10/4/2018 10:56,10/4/2019 10:56, ,ONTIME,Open,,Sidewalk Repair,Public Works Department,Highway Maintenance,Sidewalk Repair,PWDx_Highway Construction,PWDx,NULL,NULL,27-29 Ballard St  Jamaica Plain  MA  02130,9,2,6,E13,Jamaica Plain,11,Ward 19,1909,R2,27-29 Ballard St,2130,Address,7981,42.3078,-71.1179,Constituent Call,"(42.3078, -71.1179)"
1.01E+11,10/4/2018 10:49,10/4/2019 10:49, ,ONTIME,Open,,Sidewalk Repair,Public Works Department,Highway Maintenance,Sidewalk Repair,PWDx_Highway Construction,PWDx,NULL,NULL,INTERSECTION of Public Alley No. 418 & Public Alley No. 419  Boston  MA  ,4,1C,7,D4,Back Bay,14,5,507,,INTERSECTION Public Alley No. 418 & Public Alley No. 419,,Intersection,12528,42.3594,-71.0587,Employee Generated,"(0, 0)"
1.01E+11,10/4/2018 10:47,10/4/2019 10:47, ,ONTIME,Open,,Sidewalk Repair,Public Works Department,Highway Maintenance,Sidewalk Repair,PWDx_Highway Construction,PWDx,NULL,NULL,52 Sullivan St  Charlestown  MA  02129,3,1A,1,A15,Charlestown,2,Ward 2,206,CM,52 Sullivan St,2129,Address,131831,42.3789,-71.0655,Constituent Call,"(42.3789, -71.0655)"
1.01E+11,10/4/2018 7:38,10/4/2019 7:38, ,ONTIME,Open,,Sidewalk Repair,Public Works Department,Highway Maintenance,Sidewalk Repair,PWDx_Highway Construction,PWDx,NULL,NULL,47 Orchardfield St  Dorchester  MA  02122,7,3,3,C11,Dorchester,8,Ward 15,1506,R1,47 Orchardfield St,2122,Address,105515,42.3044,-71.0575,Employee Generated,"(42.3044, -71.0575)"
1.01E+11,10/4/2018 7:17,10/4/2019 7:17, ,ONTIME,Open,,Sidewalk Repair,Public Works Department,Highway Maintenance,Sidewalk Repair,PWDx_Highway Construction,PWDx,NULL,NULL,2-6 Chestnut Hill Ave  Brighton  MA  02135,11,4,9,D14,Allston / Brighton,15,Ward 22,2203,RC,2-6 Chestnut Hill Ave,2135,Address,31738,42.3489,-71.1533,Employee Generated,"(42.3489, -71.1533)"
1.01E+11,10/4/2018 6:58,10/4/2019 6:58, ,ONTIME,Open,,Sidewalk Repair,Public Works Department,Highway Maintenance,Sidewalk Repair,PWDx_Highway Construction,PWDx,NULL,NULL,30 Irving St  Boston  MA  02114,3,1B,1,A1,Beacon Hill,3,Ward 3,306,R4,30 Irving St,2114,Address,78929,42.3604,-71.0663,Employee Generated,"(42.3604, -71.0663)"
1.01E+11,10/4/2018 6:57,10/4/2019 6:57, ,ONTIME,Open,,Sidewalk Repair,Public Works Department,Highway Maintenance,Sidewalk Repair,PWDx_Highway Construction,PWDx,NULL,NULL,120 Fulton St  Boston  MA  02109,3,1B,1,A1,Downtown / Financial District,3,Ward 3,301,CC,120 Fulton St,2109,Address,61327,42.3631,-71.0526,Employee Generated,"(42.3631, -71.0526)"
1.01E+11,10/4/2018 6:56,10/4/2019 6:56, ,ONTIME,Open,,Sidewalk Repair,Public Works Department,Highway Maintenance,Sidewalk Repair,PWDx_Highway Construction,PWDx,NULL,NULL,104 Marlborough St  Boston  MA  02116,4,1C,8,D4,Back Bay,14,Ward 5,507,CM,104 Marlborough St,2116,Address,90302,42.3532,-71.0767,Employee Generated,"(42.3532, -71.0767)"
1.01E+11,10/3/2018 15:06,10/3/2019 15:06, ,ONTIME,Open,,Sidewalk Repair,Public Works Department,Highway Maintenance,Sidewalk Repair,PWDx_Highway Construction,PWDx,NULL,NULL,INTERSECTION of Fort Avenue Ter & Fort Ave  Roxbury  MA  ,9,10B,9,B2,Roxbury,13,11,1101,,INTERSECTION Fort Avenue Ter & Fort Ave,,Intersection,10700,42.3594,-71.0587,Employee Generated,"(0, 0)"
1.01E+11,10/3/2018 13:04,10/3/2019 13:04, ,ONTIME,Open,,Sidewalk Repair,Public Works Department,Highway Maintenance,Sidewalk Repair,PWDx_Highway Construction,PWDx,NULL,NULL,108 Norton St  Dorchester  MA  02122,7,3,3,C11,Dorchester,8,Ward 15,1507,R3,108 Norton St,2122,Address,103937,42.3047,-71.0667,Constituent Call,"(42.3047, -71.0667)"
1.01E+11,10/3/2018 11:39,10/3/2019 11:39, ,ONTIME,Open,,Sidewalk Repair,Public Works Department,Highway Maintenance,Sidewalk Repair,PWDx_Highway Construction,PWDx,NULL,NULL,INTERSECTION of Public Alley No. 435 & Public Alley No. 436  Boston  MA  ,4,1C,7,D4,Back Bay,14,5,507,,INTERSECTION Public Alley No. 435 & Public Alley No. 436,,Intersection,12547,42.3594,-71.0587,Employee Generated,"(0, 0)"
1.01E+11,10/3/2018 11:38,10/3/2019 11:38, ,ONTIME,Open,,Sidewalk Repair,Public Works Department,Highway Maintenance,Sidewalk Repair,PWDx_Highway Construction,PWDx,NULL,NULL,INTERSECTION of West St & Washington St  Boston  MA  ,3,1C,2,A1,Downtown / Financial District,4,3,308,,INTERSECTION West St & Washington St,,Intersection,13491,42.3594,-71.0587,Employee Generated,"(0, 0)"
1.01E+11,10/3/2018 9:47,10/3/2019 9:47, ,ONTIME,Open,,Sidewalk Repair,Public Works Department,Highway Maintenance,Sidewalk Repair,PWDx_Highway Construction,PWDx,NULL,NULL,87 Beacon St  Boston  MA  02108,3,1B,8,A1,Back Bay,14,Ward 5,505,CM,87 Beacon St,2108,Address,12344,42.3559,-71.0717,Constituent Call,"(42.3559, -71.0717)"
1.01E+11,10/3/2018 9:46,10/3/2019 9:46, ,ONTIME,Open,,Sidewalk Repair,Public Works Department,Highway Maintenance,Sidewalk Repair,PWDx_Highway Construction,PWDx,NULL,NULL,728-730 Tremont St  Roxbury  MA  02118,4,1C,7,D4,South End,6,9,902, ,728-730 Tremont St,2118,Address,350936,42.3401,-71.0782,Employee Generated,"(42.3401, -71.0782)"
1.01E+11,10/3/2018 9:40,10/3/2019 9:40, ,ONTIME,Open,,Sidewalk Repair,Public Works Department,Highway Maintenance,Sidewalk Repair,PWDx_Highway Construction,PWDx,NULL,NULL,133 Federal St  Boston  MA  02110,3,1C,1,A1,Downtown / Financial District,3,Ward 3,306,C,133 Federal St,2110,Address,57153,42.3543,-71.0566,Employee Generated,"(42.3543, -71.0566)"
1.01E+11,10/3/2018 8:41,10/3/2019 8:41, ,ONTIME,Open,,Sidewalk Repair,Public Works Department,Highway Maintenance,Sidewalk Repair,PWDx_Highway Construction,PWDx,NULL,NULL,INTERSECTION of Paul Pl & Shawmut Ave  Roxbury  MA  ,4,1C,2,D4,South End,4,3,308,,INTERSECTION Paul Pl & Shawmut Ave,,Intersection,12340,42.3594,-71.0587,Employee Generated,"(0, 0)"
1.01E+11,10/3/2018 7:14,10/3/2019 7:14, ,ONTIME,Open,,Sidewalk Repair,Public Works Department,Highway Maintenance,Sidewalk Repair,PWDx_Highway Construction,PWDx,NULL,NULL,INTERSECTION of Worcester Sq & Harrison Ave  Roxbury  MA  ,4,1C,3,D4,South End,6,8,802,,INTERSECTION Worcester Sq & Harrison Ave,,Intersection,17104,42.3594,-71.0587,Employee Generated,"(0, 0)"
1.01E+11,10/3/2018 6:37,10/3/2019 6:37, ,ONTIME,Open,,Sidewalk Repair,Public Works Department,Highway Maintenance,Sidewalk Repair,PWDx_Highway Construction,PWDx,NULL,NULL,INTERSECTION of Public Alley No. 418 & Public Alley No. 419  Boston  MA  ,4,1C,7,D4,Back Bay,14,5,507,,INTERSECTION Public Alley No. 418 & Public Alley No. 419,,Intersection,12528,42.3594,-71.0587,Employee Generated,"(0, 0)"
1.01E+11,10/2/2018 10:25,10/2/2019 10:25, ,ONTIME,Open,,Sidewalk Repair,Public Works Department,Highway Maintenance,Sidewalk Repair,PWDx_Highway Construction,PWDx,NULL,NULL,150 Boylston St  Jamaica Plain  MA  02130,9,2,6,E13,Jamaica Plain,11,Ward 11,1104,R1,150 Boylston St,2130,Address,398848,42.3164,-71.1028,Constituent Call,"(42.3164, -71.1028)"
1.01E+11,10/2/2018 6:28,10/2/2019 6:28, ,ONTIME,Open,,Sidewalk Repair,Public Works Department,Highway Maintenance,Sidewalk Repair,PWDx_Highway Construction,PWDx,NULL,NULL,INTERSECTION of Public Alley No. 436 & Public Alley No. 437  Boston  MA  ,4,1C,7,D4,Back Bay,14,5,506,,INTERSECTION Public Alley No. 436 & Public Alley No. 437,,Intersection,12548,42.3594,-71.0587,Employee Generated,"(0, 0)"
1.01E+11,10/2/2018 6:15,10/2/2019 6:15, ,ONTIME,Open,,Sidewalk Repair,Public Works Department,Highway Maintenance,Sidewalk Repair,PWDx_Highway Construction,PWDx,NULL,NULL,INTERSECTION of Tremont Pl & Beacon St  Boston  MA  ,3,1B,2,A1,Downtown / Financial District,3,3,306,,INTERSECTION Tremont Pl & Beacon St,,Intersection,13297,42.3594,-71.0587,Employee Generated,"(0, 0)"
1.01E+11,10/2/2018 6:13,10/2/2019 6:13, ,ONTIME,Open,,Sidewalk Repair,Public Works Department,Highway Maintenance,Sidewalk Repair,PWDx_Highway Construction,PWDx,NULL,NULL,3 Appleton St  Boston  MA  02116,4,1C,2,D4,Boston,6,5,501, ,3 Appleton St,2116,Address,352132,42.3467,-71.0697,Constituent Call,"(42.3467, -71.0697)"
1.01E+11,10/2/2018 6:11,10/2/2019 6:11, ,ONTIME,Open,,Sidewalk Repair,Public Works Department,Highway Maintenance,Sidewalk Repair,PWDx_Highway Construction,PWDx,NULL,NULL,319 Dartmouth St  Boston  MA  02116,4,1C,8,D4,Back Bay,14,Ward 5,507,R4,319 Dartmouth St,2116,Address,366917,42.3532,-71.0786,Employee Generated,"(42.3532, -71.0786)"
1.01E+11,10/2/2018 6:06,10/2/2019 6:06, ,ONTIME,Open,,Sidewalk Repair,Public Works Department,Highway Maintenance,Sidewalk Repair,PWDx_Highway Construction,PWDx,NULL,NULL,INTERSECTION of Bulfinch Pl & New Sudbury St  Boston  MA  ,3,1B,2,A1,Downtown / Financial District,3,3,306,,INTERSECTION Bulfinch Pl & New Sudbury St,,Intersection,16432,42.3594,-71.0587,Employee Generated,"(0, 0)"
1.01E+11,10/1/2018 11:26,10/1/2019 11:26, ,ONTIME,Open,,Sidewalk Repair,Public Works Department,Highway Maintenance,Sidewalk Repair,PWDx_Highway Construction,PWDx,NULL,NULL,361A Beacon St  Boston  MA  02116,4,1C,8,D4,Back Bay,14,Ward 5,508,R4,361A Beacon St,2116,Address,366210,42.3521,-71.084,Employee Generated,"(42.3521, -71.084)"
1.01E+11,10/1/2018 11:24,10/1/2019 11:24, ,ONTIME,Open,,Sidewalk Repair,Public Works Department,Highway Maintenance,Sidewalk Repair,PWDx_Highway Construction,PWDx,NULL,NULL,84 Beacon St  Boston  MA  02108,3,1B,8,A1,Beacon Hill,14,Ward 5,505,RC,84 Beacon St,2108,Address,155676,42.356,-71.0713,Constituent Call,"(42.356, -71.0713)"
1.01E+11,10/1/2018 11:22,10/1/2019 11:22, ,ONTIME,Open,,Sidewalk Repair,Public Works Department,Highway Maintenance,Sidewalk Repair,PWDx_Highway Construction,PWDx,NULL,NULL,9 Milford St  Roxbury  MA  02118,4,1C,2,D4,South End,4,Ward 3,307,CD,9 Milford St,2118,Address,95416,42.3438,-71.0688,Employee Generated,"(42.3438, -71.0688)"
1.01E+11,10/1/2018 11:21,10/1/2019 11:21, ,ONTIME,Open,,Sidewalk Repair,Public Works Department,Highway Maintenance,Sidewalk Repair,PWDx_Highway Construction,PWDx,NULL,NULL,907 Boylston St  Boston  MA  02115,4,1C,8,D4,Back Bay,14,Ward 5,509,RC,907 Boylston St,2115,Address,194479,42.3485,-71.0843,Employee Generated,"(42.3485, -71.0843)"
1.01E+11,10/1/2018 11:20,10/1/2019 11:20, ,ONTIME,Open,,Sidewalk Repair,Public Works Department,Highway Maintenance,Sidewalk Repair,PWDx_Highway Construction,PWDx,NULL,NULL,INTERSECTION of Ward Way & Worcester St  Roxbury  MA  ,4,1C,9,D4,South End,6,9,902,,INTERSECTION Ward Way & Worcester St,,Intersection,14078,42.3594,-71.0587,Employee Generated,"(0, 0)"
1.01E+11,10/1/2018 10:07,10/1/2019 10:07, ,ONTIME,Open,,Sidewalk Repair,Public Works Department,Highway Maintenance,Sidewalk Repair,PWDx_Highway Construction,PWDx,NULL,NULL,319 Dartmouth St  Boston  MA  02116,4,1C,8,D4,Back Bay,14,Ward 5,507,R4,319 Dartmouth St,2116,Address,366917,42.3532,-71.0786,Employee Generated,"(42.3532, -71.0786)"
1.01E+11,10/1/2018 10:06,10/1/2019 10:06, ,ONTIME,Open,,Sidewalk Repair,Public Works Department,Highway Maintenance,Sidewalk Repair,PWDx_Highway Construction,PWDx,NULL,NULL,391 Beacon St  Boston  MA  02116,4,1C,8,D4,Back Bay,14,Ward 5,508,CM,391 Beacon St,2116,Address,11338,42.3518,-71.0849,Employee Generated,"(42.3518, -71.0849)"
1.01E+11,10/1/2018 10:05,10/1/2019 10:05, ,ONTIME,Open,,Sidewalk Repair,Public Works Department,Highway Maintenance,Sidewalk Repair,PWDx_Highway Construction,PWDx,NULL,NULL,350 Beacon St  Boston  MA  02116,4,1C,8,D4,Back Bay,14,Ward 5,508,A,350 Beacon St,2116,Address,11197,42.3525,-71.0845,Employee Generated,"(42.3525, -71.0845)"
1.01E+11,10/1/2018 10:03,10/1/2019 10:03, ,ONTIME,Open,,Sidewalk Repair,Public Works Department,Highway Maintenance,Sidewalk Repair,PWDx_Highway Construction,PWDx,NULL,NULL,275 Marlborough St  Boston  MA  02116,4,1C,8,D4,Back Bay,14,Ward 5,508,A,275 Marlborough St,2116,Address,90846,42.352,-71.0828,Employee Generated,"(42.352, -71.0828)"
1.01E+11,10/1/2018 10:02,10/1/2019 10:02, ,ONTIME,Open,,Sidewalk Repair,Public Works Department,Highway Maintenance,Sidewalk Repair,PWDx_Highway Construction,PWDx,NULL,NULL,INTERSECTION of River St & Chestnut St  Boston  MA  ,3,1B,7,A1,Beacon Hill,14,5,505,,INTERSECTION River St & Chestnut St,,Intersection,12720,42.3594,-71.0587,Constituent Call,"(0, 0)"
1.01E+11,10/1/2018 6:52,10/1/2019 6:52, ,ONTIME,Open,,Sidewalk Repair,Public Works Department,Highway Maintenance,Sidewalk Repair,PWDx_Highway Construction,PWDx,NULL,NULL,INTERSECTION of Public Alley No. 435 & Public Alley No. 436  Boston  MA  ,4,1C,7,D4,Back Bay,14,5,507,,INTERSECTION Public Alley No. 435 & Public Alley No. 436,,Intersection,12547,42.3594,-71.0587,Employee Generated,"(0, 0)"
1.01E+11,10/1/2018 6:50,10/1/2019 6:50, ,ONTIME,Open,,Sidewalk Repair,Public Works Department,Highway Maintenance,Sidewalk Repair,PWDx_Highway Construction,PWDx,NULL,NULL,51 E Concord St  Roxbury  MA  02118,4,1C,2,D4,South End,6,Ward 8,802,CM,51 E Concord St,2118,Address,41834,42.3367,-71.0737,Employee Generated,"(42.3367, -71.0737)"
1.01E+11,10/1/2018 6:47,10/1/2019 6:47, ,ONTIME,Open,,Sidewalk Repair,Public Works Department,Highway Maintenance,Sidewalk Repair,PWDx_Highway Construction,PWDx,NULL,NULL,47 E Concord St  Roxbury  MA  02118,4,1C,2,D4,South End,6,Ward 8,802,R4,47 E Concord St,2118,Address,41832,42.3368,-71.0739,Employee Generated,"(42.3368, -71.0739)"
1.01E+11,10/1/2018 6:43,10/1/2019 6:43, ,ONTIME,Open,,Sidewalk Repair,Public Works Department,Highway Maintenance,Sidewalk Repair,PWDx_Highway Construction,PWDx,NULL,NULL,41 E Concord St  Roxbury  MA  02118,4,1C,2,D4,South End,6,Ward 8,802,CM,41 E Concord St,2118,Address,41825,42.3369,-71.074,Employee Generated,"(42.3369, -71.074)"
1.01E+11,10/1/2018 6:41,10/1/2019 6:41, ,ONTIME,Open,,Sidewalk Repair,Public Works Department,Highway Maintenance,Sidewalk Repair,PWDx_Highway Construction,PWDx,NULL,NULL,INTERSECTION of Hanson St & Tremont St  Boston  MA  ,4,1C,2,D4,South End,4,3,307,,INTERSECTION Hanson St & Tremont St,,Intersection,16683,42.3594,-71.0587,Employee Generated,"(0, 0)"
1.01E+11,10/1/2018 6:39,10/1/2019 6:39, ,ONTIME,Open,,Sidewalk Repair,Public Works Department,Highway Maintenance,Sidewalk Repair,PWDx_Highway Construction,PWDx,NULL,NULL,20 Wellington St  Roxbury  MA  02118,4,1C,7,D4,South End,6,Ward 4,404,R4,20 Wellington St,2118,Address,147422,42.3416,-71.0822,Employee Generated,"(42.3416, -71.0822)"
1.01E+11,10/1/2018 6:37,10/1/2019 6:37, ,ONTIME,Open,,Sidewalk Repair,Public Works Department,Highway Maintenance,Sidewalk Repair,PWDx_Highway Construction,PWDx,NULL,NULL,21 Worcester St  Roxbury  MA  02118,4,1C,7,D4,South End,6,Ward 9,902,R3,21 Worcester St,2118,Address,152418,42.3381,-71.0762,Employee Generated,"(42.3381, -71.0762)"
1.01E+11,9/29/2018 6:12,9/29/2019 6:12, ,ONTIME,Open,,Sidewalk Repair,Public Works Department,Highway Maintenance,Sidewalk Repair,PWDx_Highway Construction,PWDx,NULL,NULL,INTERSECTION of River St & Mount Vernon St  Boston  MA  ,3,1B,7,A1,Back Bay,14,5,505,,INTERSECTION River St & Mount Vernon St,,Intersection,12722,42.3594,-71.0587,Employee Generated,"(0, 0)"
1.01E+11,9/29/2018 6:11,9/29/2019 6:11, ,ONTIME,Open,,Sidewalk Repair,Public Works Department,Highway Maintenance,Sidewalk Repair,PWDx_Highway Construction,PWDx,NULL,NULL,30-34 E Concord St  Roxbury  MA  02118,4,1C,2,D4,Roxbury,6,8,802, ,30-34 E Concord St,2118,Address,348923,42.3374,-71.074,Employee Generated,"(42.3374, -71.074)"
1.01E+11,9/29/2018 6:10,9/29/2019 6:10, ,ONTIME,Open,,Sidewalk Repair,Public Works Department,Highway Maintenance,Sidewalk Repair,PWDx_Sidewalk Repair,PWDx,NULL,NULL,INTERSECTION of Cooper St & Stillman Pl  Boston  MA  ,3,1B,1,A1,Downtown / Financial District,3,3,304,,INTERSECTION Cooper St & Stillman Pl,,Intersection,15616,42.3594,-71.0587,Employee Generated,"(0, 0)"
1.01E+11,9/28/2018 6:34,9/28/2019 6:34, ,ONTIME,Open,,Sidewalk Repair,Public Works Department,Highway Maintenance,Sidewalk Repair,PWDx_Highway Construction,PWDx,NULL,NULL,22 Brimmer St  Boston  MA  02108,3,1B,8,A1,Back Bay,14,Ward 5,505,A,22 Brimmer St,2108,Address,196275,42.3581,-71.0716,Employee Generated,"(42.3581, -71.0716)"
1.01E+11,9/27/2018 14:14,9/27/2019 14:14, ,ONTIME,Open,,Sidewalk Repair,Public Works Department,Highway Maintenance,Sidewalk Repair,PWDx_Highway Construction,PWDx,NULL,NULL,3 Hancock St  Boston  MA  02114,3,1B,1,A1,Beacon Hill,3,Ward 3,306,C,3 Hancock St,2114,Address,157377,42.361,-71.0647,Employee Generated,"(42.361, -71.0647)"
1.01E+11,9/27/2018 10:41,9/27/2019 10:41, ,ONTIME,Open,,Sidewalk Repair,Public Works Department,Highway Maintenance,Sidewalk Repair,PWDx_Highway Construction,PWDx,NULL,NULL,61 Massachusetts Ave  Boston  MA  02215,4,10A,8,D4,Boston,14,5,509, ,61 Massachusetts Ave,2215,Address,352103,42.3495,-71.0891,Constituent Call,"(42.3495, -71.0891)"
1.01E+11,9/27/2018 10:25,9/27/2019 10:25, ,ONTIME,Open,,Sidewalk Repair,Public Works Department,Highway Maintenance,Sidewalk Repair,PWDx_Sidewalk Repair,PWDx,NULL,NULL,516-522 Main St  Charlestown  MA  02129,3,1A,1,A15,Charlestown,2,Ward 2,207,E,516-522 Main St,2129,Address,88650,42.3834,-71.0722,Employee Generated,"(42.3834, -71.0722)"
1.01E+11,9/27/2018 8:45,9/27/2019 8:45, ,ONTIME,Open,,Sidewalk Repair,Public Works Department,Highway Maintenance,Sidewalk Repair,PWDx_Highway Construction,PWDx,NULL,NULL,INTERSECTION of Public Alley No. 439 & Clarendon St  Boston  MA  ,4,1C,7,D4,Back Bay,14,5,507,,INTERSECTION Public Alley No. 439 & Clarendon St,,Intersection,12553,42.3594,-71.0587,Employee Generated,"(0, 0)"
1.01E+11,9/27/2018 8:44,9/27/2019 8:44, ,ONTIME,Open,,Sidewalk Repair,Public Works Department,Highway Maintenance,Sidewalk Repair,PWDx_Highway Construction,PWDx,NULL,NULL,71 E Concord St  Roxbury  MA  02118,4,1C,2,D4,South End,6,Ward 8,802,E,71 E Concord St,2118,Address,172242,42.3362,-71.0731,Employee Generated,"(42.3362, -71.0731)"
1.01E+11,9/27/2018 6:58,9/27/2019 6:58, ,ONTIME,Open,,Sidewalk Repair,Public Works Department,Highway Maintenance,Sidewalk Repair,PWDx_Highway Construction,PWDx,NULL,NULL,20 Charles St  Boston  MA  02114,3,1B,8,A1,Beacon Hill,14,5,505,CM,20 Charles St,2114,Address,163154,42.3566,-71.0698,Employee Generated,"(42.3566, -71.0698)"
1.01E+11,9/27/2018 6:08,9/27/2019 6:08,9/27/2018 7:54,ONTIME,Closed,Case Closed. Closed date : 2018-09-27 07:54:07.247 Duplicate of Existing Case Duplicate of existing case 101001757955    We have sent an engineer to evaluate and will take care of any immediate public safety hazards. Permanent restoration will be included in a future program when we address upgrades to the area sidewalks.    Michael Somers  Senior Civil Engineer  Construction Management Division  Boston Public Works  617-635-3831   Michael.Somers@Boston.gov   ,Sidewalk Repair,Public Works Department,Highway Maintenance,Sidewalk Repair,PWDx_Highway Construction,PWDx,NULL,NULL,54 Commonwealth Ave  Boston  MA  02116,4,1C,8,D4,Back Bay,14,Ward 5,506,CM,54 Commonwealth Ave,2116,Address,367614,42.3525,-71.0741,Employee Generated,"(42.3525, -71.0741)"
1.01E+11,9/27/2018 6:04,9/27/2019 6:04, ,ONTIME,Open,,Sidewalk Repair,Public Works Department,Highway Maintenance,Sidewalk Repair,PWDx_Highway Construction,PWDx,NULL,NULL,161-209 Cambridge St  Boston  MA  02114,3,1B,8,A1,Boston,3,3, ,C,161-209 Cambridge St,2114,Address,159266,42.3618,-71.0666,Employee Generated,"(42.3618, -71.0666)"
1.01E+11,9/26/2018 14:29,9/26/2019 14:29, ,ONTIME,Open,,Sidewalk Repair,Public Works Department,Highway Maintenance,Sidewalk Repair,PWDx_Highway Construction,PWDx,NULL,NULL,INTERSECTION of Shawmut Ave & Ruggles St  Roxbury  MA  ,9,10B,9,B2,Roxbury,13,9,904,,INTERSECTION Shawmut Ave & Ruggles St,,Intersection,16909,42.3594,-71.0587,Constituent Call,"(0, 0)"
1.01E+11,9/26/2018 11:05,9/26/2019 11:05, ,ONTIME,Open,,Sidewalk Repair,Public Works Department,Highway Maintenance,Sidewalk Repair,PWDx_Highway Construction,PWDx,NULL,NULL,132-148 Main St  Charlestown  MA  02129,3,1A,1,A15,Charlestown,2,Ward 2,201,C,132-148 Main St,2129,Address,167259,42.375,-71.0643,Employee Generated,"(42.375, -71.0643)"
1.01E+11,9/26/2018 11:02,9/26/2019 11:02, ,ONTIME,Open,,Sidewalk Repair,Public Works Department,Highway Maintenance,Sidewalk Repair,PWDx_Highway Construction,PWDx,NULL,NULL,INTERSECTION of Pine St & Washington St  Boston  MA  ,4,1C,2,A1,Downtown / Financial District,4,3,308,,INTERSECTION Pine St & Washington St,,Intersection,12422,42.3594,-71.0587,Employee Generated,"(0, 0)"
1.01E+11,9/26/2018 11:01,9/26/2019 11:01, ,ONTIME,Open,,Sidewalk Repair,Public Works Department,Highway Maintenance,Sidewalk Repair,PWDx_Highway Construction,PWDx,NULL,NULL,100-110 State St  Boston  MA  02109,3,1B,1,A1,Boston,3,3,306,CM,100-110 State St,2109,Address,130354,42.3593,-71.0551,Employee Generated,"(42.3593, -71.0551)"
1.01E+11,9/26/2018 10:56,9/26/2019 10:56, ,ONTIME,Open,,Sidewalk Repair,Public Works Department,Highway Maintenance,Sidewalk Repair,PWDx_Highway Construction,PWDx,NULL,NULL,9 Bowdoin St  Boston  MA  02114,3,1B,1,A1,Beacon Hill,3,Ward 3,306,RC,9 Bowdoin St,2114,Address,17618,42.361,-71.0632,Constituent Call,"(42.361, -71.0632)"
1.01E+11,9/26/2018 10:55,9/26/2019 10:55, ,ONTIME,Open,,Sidewalk Repair,Public Works Department,Highway Maintenance,Sidewalk Repair,PWDx_Highway Construction,PWDx,NULL,NULL,37 W Cedar St  Boston  MA  02114,3,1B,8,A1,Beacon Hill,14,Ward 5,504,R1,37 W Cedar St,2114,Address,26925,42.3591,-71.0699,Employee Generated,"(42.3591, -71.0699)"
1.01E+11,9/26/2018 10:54,9/26/2019 10:54, ,ONTIME,Open,,Sidewalk Repair,Public Works Department,Highway Maintenance,Sidewalk Repair,PWDx_Highway Construction,PWDx,NULL,NULL,37 Marlborough St  Boston  MA  02116,4,1C,8,D4,Back Bay,14,Ward 5,506,R1,37 Marlborough St,2116,Address,91095,42.3544,-71.0741,Employee Generated,"(42.3544, -71.0741)"
1.01E+11,9/26/2018 10:52,9/26/2019 10:52, ,ONTIME,Open,,Sidewalk Repair,Public Works Department,Highway Maintenance,Sidewalk Repair,PWDx_Highway Construction,PWDx,NULL,NULL,73 Phillips St  Boston  MA  02114,3,1B,8,A1,Beacon Hill,14,Ward 5,504,R4,73 Phillips St,2114,Address,110118,42.3604,-71.0693,Employee Generated,"(42.3604, -71.0693)"
1.01E+11,9/26/2018 10:51,9/26/2019 10:51, ,ONTIME,Open,,Sidewalk Repair,Public Works Department,Highway Maintenance,Sidewalk Repair,PWDx_Highway Construction,PWDx,NULL,NULL,1 Otis Pl  Boston  MA  02108,3,1B,8,A1,Back Bay,14,Ward 5,511,R4,1 Otis Pl,2108,Address,287944,42.3573,-71.0721,Employee Generated,"(42.3573, -71.0721)"
1.01E+11,9/26/2018 6:47,9/26/2019 6:47, ,ONTIME,Open,,Sidewalk Repair,Public Works Department,Highway Maintenance,Sidewalk Repair,PWDx_Highway Construction,PWDx,NULL,NULL,75 Hancock St  Boston  MA  02114,3,1B,8,A1,Beacon Hill,14,Ward 5,503,R1,75 Hancock St,2114,Address,68830,42.3587,-71.0646,Employee Generated,"(42.3587, -71.0646)"
1.01E+11,9/26/2018 6:45,9/26/2019 6:45, ,ONTIME,Open,,Sidewalk Repair,Public Works Department,Highway Maintenance,Sidewalk Repair,PWDx_Highway Construction,PWDx,NULL,NULL,10 Chandler St  Boston  MA  02116,4,1C,2,D4,South End,6,Ward 5,501,E,10 Chandler St,2116,Address,163124,42.3471,-71.0696,Constituent Call,"(42.3471, -71.0696)"
1.01E+11,9/26/2018 6:41,9/26/2019 6:41, ,ONTIME,Open,,Sidewalk Repair,Public Works Department,Highway Maintenance,Sidewalk Repair,PWDx_Highway Construction,PWDx,NULL,NULL,108 Charles St  Boston  MA  02114,3,1B,8,A1,Back Bay,14,Ward 5,511,CM,108 Charles St,2114,Address,363489,42.3589,-71.0709,Employee Generated,"(42.3589, -71.0709)"
1.01E+11,9/25/2018 14:50,9/25/2019 14:50, ,ONTIME,Open,,Sidewalk Repair,Public Works Department,Highway Maintenance,Sidewalk Repair,PWDx_Highway Construction,PWDx,NULL,NULL,INTERSECTION of Columbus Ave & Massachusetts Tpke E  Boston  MA  ,4,1C,2,D4,Back Bay,6,4,402,,INTERSECTION Columbus Ave & Massachusetts Tpke E,,Intersection,15083,42.3594,-71.0587,Employee Generated,"(0, 0)"
1.01E+11,9/25/2018 14:49,9/25/2019 14:49, ,ONTIME,Open,,Sidewalk Repair,Public Works Department,Highway Maintenance,Sidewalk Repair,PWDx_Highway Construction,PWDx,NULL,NULL,INTERSECTION of Cleveland Pl & Snow Hill St  Boston  MA  ,3,1B,1,A1,Downtown / Financial District,3,3,303,,INTERSECTION Cleveland Pl & Snow Hill St,,Intersection,15997,42.3594,-71.0587,Employee Generated,"(0, 0)"
1.01E+11,9/25/2018 14:48,9/25/2019 14:48, ,ONTIME,Open,,Sidewalk Repair,Public Works Department,Highway Maintenance,Sidewalk Repair,PWDx_Highway Construction,PWDx,NULL,NULL,INTERSECTION of Beach St & Interstate 93 S  Boston  MA  ,4,1C,2,A1,Downtown / Financial District,4,3,308,,INTERSECTION Beach St & Interstate 93 S,,Intersection,16334,42.3594,-71.0587,Employee Generated,"(0, 0)"
1.01E+11,9/25/2018 13:17,9/25/2019 13:17, ,ONTIME,Open,,Sidewalk Repair,Public Works Department,Highway Maintenance,Sidewalk Repair,PWDx_Highway Construction,PWDx,NULL,NULL,44 Weld Hill St  Jamaica Plain  MA  02130,12,2,6,E13,Jamaica Plain,11,11,1108, ,44 Weld Hill St,2130,Address,345906,42.2982,-71.1125,Employee Generated,"(42.2982, -71.1125)"
1.01E+11,9/25/2018 13:07,9/25/2019 13:07, ,ONTIME,Open,,Sidewalk Repair,Public Works Department,Highway Maintenance,Sidewalk Repair,PWDx_Highway Construction,PWDx,NULL,NULL,90 Bynner St  Jamaica Plain  MA  02130,9,2,6,E13,Jamaica Plain,11,10,1009,CM,90 Bynner St,2130,Address,162800,42.3239,-71.1126,Employee Generated,"(42.3239, -71.1126)"
1.01E+11,9/25/2018 12:39,9/25/2019 12:39, ,ONTIME,Open,,Sidewalk Repair,Public Works Department,Highway Maintenance,Sidewalk Repair,PWDx_Highway Construction,PWDx,NULL,NULL,32 Brier Rd  West Roxbury  MA  02132,12,6,6,E5,West Roxbury,12,Ward 20,2010,R1,32 Brier Rd,2132,Address,20042,42.275,-71.1519,City Worker App,"(42.275, -71.1519)"
1.01E+11,9/25/2018 10:29,9/25/2019 10:29, ,ONTIME,Open,,Sidewalk Repair,Public Works Department,Highway Maintenance,Sidewalk Repair,PWDx_Highway Construction,PWDx,NULL,NULL,606-608 E Second St  South Boston  MA  02127,6,5,2,C6,South Boston / South Boston Waterfront,5,Ward 6,605,R4,606-608 E Second St,2127,Address,124384,42.3374,-71.0389,Constituent Call,"(42.3374, -71.0389)"
1.01E+11,9/25/2018 8:18,9/25/2019 8:18, ,ONTIME,Open,,Sidewalk Repair,Public Works Department,Highway Maintenance,Sidewalk Repair,PWDx_Highway Construction,PWDx,NULL,NULL,11 Larchmont St  Dorchester  MA  02124,7,3,4,C11,Dorchester,8,Ward 17,1702,R1,11 Larchmont St,2124,Address,84056,42.2975,-71.0677,Constituent Call,"(42.2975, -71.0677)"
1.01E+11,9/24/2018 14:38,9/24/2019 14:38, ,ONTIME,Open,,Sidewalk Repair,Public Works Department,Highway Maintenance,Sidewalk Repair,PWDx_Highway Construction,PWDx,NULL,NULL,220 Marlborough St  Boston  MA  02116,4,1C,8,D4,Boston,14,5,508,CM,220 Marlborough St,2116,Address,167428,42.352,-71.081,Employee Generated,"(42.352, -71.081)"
1.01E+11,9/24/2018 14:37,9/24/2019 14:37, ,ONTIME,Open,,Sidewalk Repair,Public Works Department,Highway Maintenance,Sidewalk Repair,PWDx_Highway Construction,PWDx,NULL,NULL,300 Beacon St  Boston  MA  02116,4,1C,8,D4,Back Bay,14,Ward 5,508,R4,300 Beacon St,2116,Address,10899,42.353,-71.0823,Employee Generated,"(42.353, -71.0823)"
1.01E+11,9/24/2018 14:35,9/24/2019 14:35, ,ONTIME,Open,,Sidewalk Repair,Public Works Department,Highway Maintenance,Sidewalk Repair,PWDx_Highway Construction,PWDx,NULL,NULL,350 Beacon St  Boston  MA  02116,4,1C,8,D4,Back Bay,14,Ward 5,508,A,350 Beacon St,2116,Address,11197,42.3525,-71.0845,Employee Generated,"(42.3525, -71.0845)"
1.01E+11,9/24/2018 14:34,9/24/2019 14:34, ,ONTIME,Open,,Sidewalk Repair,Public Works Department,Highway Maintenance,Sidewalk Repair,PWDx_Highway Construction,PWDx,NULL,NULL,426 Beacon St  Boston  MA  02115,4,1C,8,D4,Back Bay,14,Ward 5,509,E,426 Beacon St,2115,Address,11453,42.3518,-71.0869,Employee Generated,"(42.3518, -71.0869)"
1.01E+11,9/24/2018 14:33,9/24/2019 14:33, ,ONTIME,Open,,Sidewalk Repair,Public Works Department,Highway Maintenance,Sidewalk Repair,PWDx_Highway Construction,PWDx,NULL,NULL,486-488 Beacon St  Boston  MA  02115,4,1C,8,D4,Back Bay,14,Ward 5,509,CM,486-488 Beacon St,2115,Address,11734,42.3513,-71.0889,Employee Generated,"(42.3513, -71.0889)"
1.01E+11,9/24/2018 14:31,9/24/2019 14:31, ,ONTIME,Open,,Sidewalk Repair,Public Works Department,Highway Maintenance,Sidewalk Repair,PWDx_Highway Construction,PWDx,NULL,NULL,400 Beacon St  Boston  MA  02116,4,1C,8,D4,Back Bay,14,Ward 5,508,R1,400 Beacon St,2116,Address,11363,42.3522,-71.0855,Employee Generated,"(42.3522, -71.0855)"
1.01E+11,9/24/2018 14:29,9/24/2019 14:29, ,ONTIME,Open,,Sidewalk Repair,Public Works Department,Highway Maintenance,Sidewalk Repair,PWDx_Highway Construction,PWDx,NULL,NULL,392 Hanover St  Boston  MA  02113,3,1B,1,A1,Boston,3,3,301,RC,392 Hanover St,2113,Address,165988,42.3658,-71.0532,Employee Generated,"(42.3658, -71.0532)"
1.01E+11,9/24/2018 13:25,9/24/2019 13:25, ,ONTIME,Open,,Sidewalk Repair,Public Works Department,Highway Maintenance,Sidewalk Repair,PWDx_Highway Construction,PWDx,NULL,NULL,36 Appleton St  Boston  MA  02116,4,1C,2,D4,South End,6,Ward 5,501,R4,36 Appleton St,2116,Address,178703,42.3458,-71.0717,Employee Generated,"(42.3458, -71.0717)"
1.01E+11,9/21/2018 12:30,9/21/2019 12:30,9/21/2018 13:25,ONTIME,Closed,Case Closed. Closed date : 2018-09-21 13:25:53.583 Duplicate of Existing Case Duplicate of existing case 101000841564    We have sent an engineer to evaluate and will take care of any immediate public safety hazards. Permanent restoration will be included in a future program when we address upgrades to the area sidewalks.    Michael Somers  Senior Civil Engineer  Construction Management Division  Boston Public Works  617-635-3831   Michael.Somers@Boston.gov   ,Sidewalk Repair,Public Works Department,Highway Maintenance,Sidewalk Repair,PWDx_Sidewalk Repair,PWDx,NULL,NULL,INTERSECTION of Centre Pl & Centre St  Roxbury  MA  ,9,10B,9,B2,Roxbury,13,11,1101,,INTERSECTION Centre Pl & Centre St,,Intersection,9695,42.3594,-71.0587,Employee Generated,"(0, 0)"
1.01E+11,9/21/2018 11:21,9/21/2019 11:21, ,ONTIME,Open,,Sidewalk Repair,Public Works Department,Highway Maintenance,Sidewalk Repair,PWDx_Highway Construction,PWDx,NULL,NULL,32 Mount Vernon St  Boston  MA  02108,3,1B,8,A1,Beacon Hill,14,Ward 5,503,R1,32 Mount Vernon St,2108,Address,98558,42.3582,-71.0658,Employee Generated,"(42.3582, -71.0658)"
1.01E+11,9/21/2018 11:19,9/21/2019 11:19, ,ONTIME,Open,,Sidewalk Repair,Public Works Department,Highway Maintenance,Sidewalk Repair,PWDx_Highway Construction,PWDx,NULL,NULL,393 Beacon St  Boston  MA  02116,4,1C,8,D4,Back Bay,14,Ward 5,508,A,393 Beacon St,2116,Address,184212,42.3518,-71.085,Employee Generated,"(42.3518, -71.085)"
1.01E+11,9/21/2018 11:18,9/21/2019 11:18, ,ONTIME,Open,,Sidewalk Repair,Public Works Department,Highway Maintenance,Sidewalk Repair,PWDx_Highway Construction,PWDx,NULL,NULL,330 Beacon St  Boston  MA  02116,4,1C,8,D4,Back Bay,14,5,508,,330 Beacon St,2116,Address,161905,42.3529,-71.0834,Employee Generated,"(42.3529, -71.0834)"
1.01E+11,9/21/2018 11:17,9/21/2019 11:17, ,ONTIME,Open,,Sidewalk Repair,Public Works Department,Highway Maintenance,Sidewalk Repair,PWDx_Highway Construction,PWDx,NULL,NULL,383 Beacon St  Boston  MA  02116,4,1C,8,D4,Back Bay,14,Ward 5,508,CM,383 Beacon St,2116,Address,11320,42.3519,-71.0847,Employee Generated,"(42.3519, -71.0847)"
1.01E+11,9/21/2018 11:15,9/21/2019 11:15, ,ONTIME,Open,,Sidewalk Repair,Public Works Department,Highway Maintenance,Sidewalk Repair,PWDx_Highway Construction,PWDx,NULL,NULL,334 Beacon St  Boston  MA  02116,4,1C,8,D4,Back Bay,14,Ward 5,508,CM,334 Beacon St,2116,Address,366225,42.3526,-71.0839,Employee Generated,"(42.3526, -71.0839)"
1.01E+11,9/21/2018 11:13,9/21/2019 11:13, ,ONTIME,Open,,Sidewalk Repair,Public Works Department,Highway Maintenance,Sidewalk Repair,PWDx_Highway Construction,PWDx,NULL,NULL,15 Gloucester St  Boston  MA  02116,4,1C,8,D4,Back Bay,14,Ward 5,508,CD,15 Gloucester St,2116,Address,64898,42.3508,-71.0848,Employee Generated,"(42.3508, -71.0848)"
1.01E+11,9/21/2018 11:12,9/21/2019 11:12, ,ONTIME,Open,,Sidewalk Repair,Public Works Department,Highway Maintenance,Sidewalk Repair,PWDx_Highway Construction,PWDx,NULL,NULL,44 Commonwealth Ave  Boston  MA  02116,4,1C,8,D4,Back Bay,14,Ward 5,506,C,44 Commonwealth Ave,2116,Address,40827,42.3527,-71.0734,Employee Generated,"(42.3527, -71.0734)"
1.01E+11,9/21/2018 11:11,9/21/2019 11:11, ,ONTIME,Open,,Sidewalk Repair,Public Works Department,Highway Maintenance,Sidewalk Repair,PWDx_Highway Construction,PWDx,NULL,NULL,297 Commonwealth Ave  Boston  MA  02115,4,1C,8,D4,Back Bay,14,Ward 5,509,CM,297 Commonwealth Ave,2115,Address,40043,42.3503,-71.0858,Employee Generated,"(42.3503, -71.0858)"
1.01E+11,9/21/2018 11:08,9/21/2019 11:08, ,ONTIME,Open,,Sidewalk Repair,Public Works Department,Highway Maintenance,Sidewalk Repair,PWDx_Highway Construction,PWDx,NULL,NULL,282 Marlborough St  Boston  MA  02116,4,1C,8,D4,Back Bay,14,Ward 5,508,CM,282 Marlborough St,2116,Address,90856,42.3514,-71.0833,Employee Generated,"(42.3514, -71.0833)"
1.01E+11,9/21/2018 11:07,9/21/2019 11:07, ,ONTIME,Open,,Sidewalk Repair,Public Works Department,Highway Maintenance,Sidewalk Repair,PWDx_Highway Construction,PWDx,NULL,NULL,110 Commonwealth Ave  Boston  MA  02116,4,1C,8,D4,Back Bay,14,5,507,E,110 Commonwealth Ave,2116,Address,340858,42.3519,-71.0763,Employee Generated,"(42.3519, -71.0763)"
1.01E+11,9/21/2018 11:06,9/21/2019 11:06, ,ONTIME,Open,,Sidewalk Repair,Public Works Department,Highway Maintenance,Sidewalk Repair,PWDx_Highway Construction,PWDx,NULL,NULL,167 Beacon St  Boston  MA  02116,4,1C,8,D4,Back Bay,14,Ward 5,506,CM,167 Beacon St,2116,Address,366686,42.3544,-71.0755,Employee Generated,"(42.3544, -71.0755)"
1.01E+11,9/21/2018 11:04,9/21/2019 11:04, ,ONTIME,Open,,Sidewalk Repair,Public Works Department,Highway Maintenance,Sidewalk Repair,PWDx_Highway Construction,PWDx,NULL,NULL,151-153 Beacon St  Boston  MA  02116,4,1C,8,D4,Back Bay,14,Ward 5,506,CM,151-153 Beacon St,2116,Address,9674,42.3545,-71.075,Employee Generated,"(42.3545, -71.075)"
1.01E+11,9/21/2018 6:35,9/21/2019 6:35, ,ONTIME,Open,,Sidewalk Repair,Public Works Department,Highway Maintenance,Sidewalk Repair,PWDx_Highway Construction,PWDx,NULL,NULL,21 E Concord St  Roxbury  MA  02118,4,1C,2,D4,South End,6,Ward 8,802,R2,21 E Concord St,2118,Address,41766,42.3374,-71.0746,Employee Generated,"(42.3374, -71.0746)"
1.01E+11,9/20/2018 12:58,9/20/2019 12:58, ,ONTIME,Open,,Sidewalk Repair,Public Works Department,Highway Maintenance,Sidewalk Repair,PWDx_Sidewalk Repair,PWDx,NULL,NULL,26 Everett St  Dorchester  MA  02122,7,7,3,C11,Dorchester,7,Ward 16,1602,R1,26 Everett St,2122,Address,55251,42.3011,-71.0517,Constituent Call,"(42.3011, -71.0517)"
1.01E+11,9/20/2018 12:55,9/20/2019 12:55, ,ONTIME,Open,,Sidewalk Repair,Public Works Department,Highway Maintenance,Sidewalk Repair,PWDx_Sidewalk Repair,PWDx,NULL,NULL,26 Everett St  Dorchester  MA  02122,7,7,3,C11,Dorchester,7,Ward 16,1602,R1,26 Everett St,2122,Address,55251,42.3011,-71.0517,Constituent Call,"(42.3011, -71.0517)"
1.01E+11,9/20/2018 11:43,9/20/2019 11:43, ,ONTIME,Open,,Sidewalk Repair,Public Works Department,Highway Maintenance,Sidewalk Repair,PWDx_Highway Construction,PWDx,NULL,NULL,754 Huntington Ave  Mission Hill  MA  02120,9,10A,8,B2,Mission Hill,14,Ward 10,1003,RC,754 Huntington Ave,2120,Address,76421,42.3335,-71.1057,Constituent Call,"(42.3335, -71.1057)"
1.01E+11,9/20/2018 11:17,9/20/2019 11:17, ,ONTIME,Open,,Sidewalk Repair,Public Works Department,Highway Maintenance,Sidewalk Repair,PWDx_Highway Construction,PWDx,NULL,NULL,15 Charles St  Boston  MA  02114,3,1B,8,A1,Beacon Hill,14,Ward 5,503,RC,15 Charles St,2114,Address,29133,42.3566,-71.0694,Constituent Call,"(42.3566, -71.0694)"
1.01E+11,9/20/2018 11:15,9/20/2019 11:15, ,ONTIME,Open,,Sidewalk Repair,Public Works Department,Highway Maintenance,Sidewalk Repair,PWDx_Highway Construction,PWDx,NULL,NULL,268-272 Commonwealth Ave  Boston  MA  02116,4,1C,8,D4,Back Bay,14,Ward 5,508,E,268-272 Commonwealth Ave,2116,Address,39886,42.35,-71.0837,Employee Generated,"(42.35, -71.0837)"
1.01E+11,9/20/2018 11:14,9/20/2019 11:14, ,ONTIME,Open,,Sidewalk Repair,Public Works Department,Highway Maintenance,Sidewalk Repair,PWDx_Highway Construction,PWDx,NULL,NULL,297 Commonwealth Ave  Boston  MA  02115,4,1C,8,D4,Back Bay,14,Ward 5,509,CM,297 Commonwealth Ave,2115,Address,40043,42.3503,-71.0858,Employee Generated,"(42.3503, -71.0858)"
1.01E+11,9/20/2018 11:09,9/20/2019 11:09, ,ONTIME,Open,,Sidewalk Repair,Public Works Department,Highway Maintenance,Sidewalk Repair,PWDx_Highway Construction,PWDx,NULL,NULL,246 Beacon St  Boston  MA  02116, , ,0, ,Boston,0,5, , ,246 Beacon St,2116,Address,348520,42.3537,-71.0798,Employee Generated,"(42.3537, -71.0798)"
1.01E+11,9/20/2018 11:08,9/20/2019 11:08, ,ONTIME,Open,,Sidewalk Repair,Public Works Department,Highway Maintenance,Sidewalk Repair,PWDx_Highway Construction,PWDx,NULL,NULL,124 Beacon St  Boston  MA  02116,4,1C,8,D4,Back Bay,14,Ward 5,506,CM,124 Beacon St,2116,Address,366739,42.3552,-71.0744,Employee Generated,"(42.3552, -71.0744)"
1.01E+11,9/20/2018 11:06,9/20/2019 11:06, ,ONTIME,Open,,Sidewalk Repair,Public Works Department,Highway Maintenance,Sidewalk Repair,PWDx_Highway Construction,PWDx,NULL,NULL,INTERSECTION of Irving St & Cambridge St  Boston  MA  ,3,1B,2,A1,Beacon Hill,3,3,306,,INTERSECTION Irving St & Cambridge St,,Intersection,14605,42.3594,-71.0587,Employee Generated,"(0, 0)"
1.01E+11,9/20/2018 10:36,9/20/2019 10:36, ,ONTIME,Open,,Sidewalk Repair,Public Works Department,Highway Maintenance,Sidewalk Repair,PWDx_Highway Construction,PWDx,NULL,NULL,100 Sheridan St  Jamaica Plain  MA  02130,9,2,6,E13,Jamaica Plain,11,Ward 19,1901,R2,100 Sheridan St,2130,Address,310890,42.3197,-71.1061,Constituent Call,"(42.3197, -71.1061)"
1.01E+11,9/20/2018 6:32,9/20/2019 6:32,9/20/2018 20:21,ONTIME,Closed,Case Closed. Closed date : 2018-09-20 20:21:29.287 Case Resolved Dated sidewalk cut has eroded...PWD will schedule this location for temp patch paving. ,Sidewalk Repair,Public Works Department,Highway Maintenance,Sidewalk Repair,PWDx_Contractor Complaints,PWDx,NULL,NULL,INTERSECTION of Bedford St & Kingston St  Boston  MA  ,3,1C,2,A1,Downtown / Financial District,4,3,308,,INTERSECTION Bedford St & Kingston St,,Intersection,15827,42.3594,-71.0587,Employee Generated,"(0, 0)"
1.01E+11,9/20/2018 6:01,9/20/2019 6:01, ,ONTIME,Open,,Sidewalk Repair,Public Works Department,Highway Maintenance,Sidewalk Repair,PWDx_Sidewalk Repair,PWDx,NULL,NULL,71-75 Byron St  East Boston  MA  02128,1,9,1,A7,East Boston,1,Ward 1,111,R1,71-75 Byron St,2128,Address,24610,42.3844,-71.0188,Constituent Call,"(42.3844, -71.0188)"
1.01E+11,9/19/2018 5:30,9/19/2019 5:30, ,ONTIME,Open,,BREAKOUT,Public Works Department,Highway Maintenance,Sidewalk Repair,PWDx_Highway Construction,PWDx,NULL,NULL,INTERSECTION of Chelsea St & Fifth St  Charlestown  MA  ,3,1A,1,A15,Charlestown,2,2,202,,INTERSECTION Chelsea St & Fifth St,,Intersection,18032,42.3594,-71.0587,Employee Generated,"(0, 0)"
1.01E+11,9/18/2018 12:55,9/18/2019 12:55, ,ONTIME,Open,,BREAKOUT,Public Works Department,Highway Maintenance,Sidewalk Repair,PWDx_Highway Construction,PWDx,NULL,NULL,INTERSECTION of Sagamore St & Savin Hill Ave  Dorchester  MA  ,7,3,3,C11,Dorchester,7,13,1309,,INTERSECTION Sagamore St & Savin Hill Ave,,Intersection,12840,42.3594,-71.0587,Constituent Call,"(0, 0)"
1.01E+11,9/18/2018 12:55,9/18/2019 12:55, ,ONTIME,Open,,BREAKOUT,Public Works Department,Highway Maintenance,Sidewalk Repair,PWDx_Highway Construction,PWDx,NULL,NULL,INTERSECTION of Sagamore St & Savin Hill Ave  Dorchester  MA  ,7,3,3,C11,Dorchester,7,13,1309,,INTERSECTION Sagamore St & Savin Hill Ave,,Intersection,12840,42.3594,-71.0587,Constituent Call,"(0, 0)"
1.01E+11,9/18/2018 6:17,9/18/2019 6:17,9/18/2018 9:46,ONTIME,Closed,Case Closed. Closed date : 2018-09-18 09:46:37.333 Duplicate of Existing Case ,Sidewalk Repair,Public Works Department,Highway Maintenance,Sidewalk Repair,PWDx_Highway Construction,PWDx,NULL,NULL,INTERSECTION of Carver St & Boylston St  Boston  MA  ,4,1C,7,A1,Beacon Hill,6,5,501,,INTERSECTION Carver St & Boylston St,,Intersection,9619,42.3594,-71.0587,Employee Generated,"(0, 0)"
1.01E+11,9/18/2018 6:11,9/18/2019 6:11, ,ONTIME,Open,,Sidewalk Repair,Public Works Department,Highway Maintenance,Sidewalk Repair,INFO_Mass DOT,INFO,NULL,NULL,INTERSECTION of Oliver St & Seaport Blvd  Boston  MA  ,3,1C,2,A1,Downtown / Financial District,3,3,306,,INTERSECTION Oliver St & Seaport Blvd,,Intersection,14596,42.3594,-71.0587,Employee Generated,"(0, 0)"
1.01E+11,9/18/2018 6:09,9/18/2019 6:09, ,ONTIME,Open,,RED BRICK,Public Works Department,Highway Maintenance,Sidewalk Repair,PWDx_Highway Construction,PWDx,NULL,NULL,131 Pembroke St  Roxbury  MA  02118,4,1C,2,D4,South End,6,Ward 4,403,CM,131 Pembroke St,2118,Address,109050,42.3431,-71.0771,Employee Generated,"(42.3431, -71.0771)"
1.01E+11,9/17/2018 13:38,9/17/2019 13:38, ,ONTIME,Open,,RED BRICK,Public Works Department,Highway Maintenance,Sidewalk Repair,PWDx_Highway Construction,PWDx,NULL,NULL,162-164 Commercial St  Boston  MA  02109,3,1B,1,A1,Downtown / Financial District,3,Ward 3,301,R4,162-164 Commercial St,2109,Address,36216,42.3626,-71.0523,Employee Generated,"(42.3626, -71.0523)"
1.01E+11,9/17/2018 13:36,9/17/2019 13:36,9/20/2018 10:04,ONTIME,Closed,Case Closed. Closed date : 2018-09-20 10:04:40.557 Case Resolved I dont see a dangerous piece of metal. Please add a better picture.  ,Sidewalk Repair,Public Works Department,Highway Maintenance,Sidewalk Repair,PWDx_Highway Construction,PWDx,NULL,NULL,200 Columbus Ave  Boston  MA  02116,4,1C,2,A1,Boston,6,5,501,E,200 Columbus Ave,2116,Address,341719,42.3489,-71.071,Employee Generated,"(42.3489, -71.071)"
1.01E+11,9/17/2018 13:29,9/17/2019 13:29,9/24/2018 12:40,ONTIME,Closed,Case Closed. Closed date : 2018-09-24 12:40:08.52 Case Resolved ,Sidewalk Repair,Public Works Department,Highway Maintenance,Sidewalk Repair,PWDx_District 1C: Downtown,PWDx,NULL,https://cityworker.cityofboston.gov:8443/attachments/report/5b9fe4b570b4576e5f6cdc1e/closed_photo/Report.jpg,208-212 South St  Boston  MA  02111,4,1C,2,A1,Downtown / Financial District,4,Ward 3,308,CM,208-212 South St,2111,Address,128545,42.3499,-71.0574,Employee Generated,"(42.3499, -71.0574)"
1.01E+11,9/17/2018 13:27,9/17/2019 13:27, ,ONTIME,Open,,Sidewalk Repair,Public Works Department,Highway Maintenance,Sidewalk Repair,PWDx_Sidewalk Repair,PWDx,NULL,NULL,INTERSECTION of Blossom Ct & Blossom St  Boston  MA  ,3,1B,7,A1,Back Bay,3,3,305,,INTERSECTION Blossom Ct & Blossom St,,Intersection,9315,42.3594,-71.0587,Employee Generated,"(0, 0)"
1.01E+11,9/17/2018 13:24,9/17/2019 13:24, ,ONTIME,Open,,RED BRICK,Public Works Department,Highway Maintenance,Sidewalk Repair,PWDx_Highway Construction,PWDx,NULL,NULL,INTERSECTION of Louisburg Sq & Willow St  Boston  MA  ,3,1B,7,A1,Beacon Hill,14,5,503,,INTERSECTION Louisburg Sq & Willow St,,Intersection,11684,42.3594,-71.0587,Employee Generated,"(0, 0)"
1.01E+11,9/17/2018 13:20,9/17/2019 13:20, ,ONTIME,Open,,RED BRICK,Public Works Department,Highway Maintenance,Sidewalk Repair,PWDx_Highway Construction,PWDx,NULL,NULL,INTERSECTION of Lawrence St & Clarendon St  Boston  MA  ,4,1C,2,D4,South End,6,5,501,,INTERSECTION Lawrence St & Clarendon St,,Intersection,15400,42.3594,-71.0587,Constituent Call,"(0, 0)"
1.01E+11,9/17/2018 13:18,9/17/2019 13:18, ,ONTIME,Open,,RED BRICK,Public Works Department,Highway Maintenance,Sidewalk Repair,PWDx_Highway Construction,PWDx,NULL,NULL,96-98 Charles St  Boston  MA  02114,3,1B,8,A1,Back Bay,14,Ward 5,511,RC,96-98 Charles St,2114,Address,29219,42.3586,-71.0709,Employee Generated,"(42.3586, -71.0709)"
1.01E+11,9/17/2018 13:16,9/17/2019 13:16, ,ONTIME,Open,,RED BRICK,Public Works Department,Highway Maintenance,Sidewalk Repair,PWDx_Highway Construction,PWDx,NULL,NULL,INTERSECTION of Park St & Warren St  Charlestown  MA  ,3,1A,1,A15,Charlestown,2,2,201,,INTERSECTION Park St & Warren St,,Intersection,16161,42.3594,-71.0587,Constituent Call,"(0, 0)"
1.01E+11,9/17/2018 13:12,9/17/2019 13:12, ,ONTIME,Open,,RED BRICK,Public Works Department,Highway Maintenance,Sidewalk Repair,PWDx_Highway Construction,PWDx,NULL,NULL,32 Cedar Lane Way  Boston  MA  02114,3,1B,8,A1,Beacon Hill,14,Ward 5,511,R1,32 Cedar Lane Way,2114,Address,27113,42.3581,-71.0701,Employee Generated,"(42.3581, -71.0701)"
